"Status","Start Time","Stop Time","Duration in ms","Parent Suite","Suite","Sub Suite","Test Class","Test Method","Name","Description"
"passed","Mon Oct 21 08:01:04 GMT 2024","Mon Oct 21 08:01:04 GMT 2024","110","","CliKintoneTest-41 Should return the error message when lacking of --file-path option.","","","","CliKintoneTest-41 Should return the error message when lacking of --file-path option.",""
"passed","Mon Oct 21 08:02:47 GMT 2024","Mon Oct 21 08:02:49 GMT 2024","1362","","CliKintoneTest-77 Should return the error message when importing with empty input for the required field.","","","","CliKintoneTest-77 Should return the error message when importing with empty input for the required field.",""
"passed","Mon Oct 21 08:02:09 GMT 2024","Mon Oct 21 08:02:13 GMT 2024","4100","","CliKintoneTest-55 Should import the records successfully with --fields specified, including field code of the table.","","","","CliKintoneTest-55 Should import the records successfully with --fields specified, including field code of the table.",""
"passed","Mon Oct 21 07:58:43 GMT 2024","Mon Oct 21 07:58:43 GMT 2024","1","logHandler","","","","","should set ""none"" to the log config level when log-level argument is ""none""",""
"passed","Mon Oct 21 07:58:41 GMT 2024","Mon Oct 21 07:58:41 GMT 2024","2","AddRecordsError","","","","","should return error message",""
"passed","Mon Oct 21 08:00:53 GMT 2024","Mon Oct 21 08:00:58 GMT 2024","4855","","CliKintoneTest-97 Should return the record contents with valid condition query (-c option).","","","","CliKintoneTest-97 Should return the record contents with valid condition query (-c option).",""
"passed","Mon Oct 21 07:58:43 GMT 2024","Mon Oct 21 07:58:43 GMT 2024","1","logHandler","","","","","should set ""fatal"" to the log config level when log-level argument is ""fatal""",""
"passed","Mon Oct 21 07:58:40 GMT 2024","Mon Oct 21 07:58:40 GMT 2024","1","convertFieldValue","","","","","[10] convert RADIO_BUTTON field correctly",""
"passed","Mon Oct 21 07:58:40 GMT 2024","Mon Oct 21 07:58:40 GMT 2024","1","StandardLogger","","","","","should not display any message when calling logger with 'none' level",""
"passed","Mon Oct 21 07:58:40 GMT 2024","Mon Oct 21 07:58:40 GMT 2024","1","convertFieldValue","","","","","[25] convert GROUP_SELECT field correctly",""
"passed","Mon Oct 21 07:58:40 GMT 2024","Mon Oct 21 07:58:40 GMT 2024","1","convertFieldValue","","","","","[11] convert DROP_DOWN field correctly",""
"passed","Mon Oct 21 07:58:40 GMT 2024","Mon Oct 21 07:58:40 GMT 2024","1","convertFieldValue","","","","","[3] convert MULTI_LINE_TEXT field correctly",""
"passed","Mon Oct 21 07:59:53 GMT 2024","Mon Oct 21 07:59:58 GMT 2024","4581","","CliKintoneTest-88 Should return the record contents in CSV format with -u and --password options.","","","","CliKintoneTest-88 Should return the record contents in CSV format with -u and --password options.",""
"passed","Mon Oct 21 07:58:40 GMT 2024","Mon Oct 21 07:58:40 GMT 2024","3","convertFieldValue","","","","","[0] convert CREATOR field correctly",""
"passed","Mon Oct 21 07:58:40 GMT 2024","Mon Oct 21 07:58:40 GMT 2024","1","convertFieldValue","","","","","[25] convert ORGANIZATION_SELECT field correctly",""
"skipped","Mon Oct 21 07:58:38 GMT 2024","","","getRecords","","","","","can download files including special characters in subTable",""
"passed","Mon Oct 21 07:58:40 GMT 2024","Mon Oct 21 07:58:40 GMT 2024","1","StandardLogger","","","","","should display INFO message when calling logger with ""info"" level",""
"passed","Mon Oct 21 07:58:39 GMT 2024","Mon Oct 21 07:58:39 GMT 2024","1","upsertRecords","","","","","should throw error when update key field does not exist on input record",""
"passed","Mon Oct 21 08:01:07 GMT 2024","Mon Oct 21 08:01:12 GMT 2024","4737","","CliKintoneTest-100 Should return the record contents when exporting the record with --fields specified.","","","","CliKintoneTest-100 Should return the record contents when exporting the record with --fields specified.",""
"passed","Mon Oct 21 07:58:40 GMT 2024","Mon Oct 21 07:58:40 GMT 2024","0","convertFieldValue","","","","","[22] convert USER_SELECT field correctly",""
"passed","Mon Oct 21 08:01:23 GMT 2024","Mon Oct 21 08:01:28 GMT 2024","4453","","CliKintoneTest-109 Should return the record contents when exporting the record with correct --guest-space-id specified","","","","CliKintoneTest-109 Should return the record contents when exporting the record with correct --guest-space-id specified",""
"passed","Mon Oct 21 08:01:28 GMT 2024","Mon Oct 21 08:01:33 GMT 2024","4806","","CliKintoneTest-111 Should return the record contents when exporting the record with --encoding option is utf8.","","","","CliKintoneTest-111 Should return the record contents when exporting the record with --encoding option is utf8.",""
"passed","Mon Oct 21 07:58:40 GMT 2024","Mon Oct 21 07:58:40 GMT 2024","1","convertFieldValue","","","","","[24] convert ORGANIZATION_SELECT field correctly",""
"passed","Mon Oct 21 07:58:44 GMT 2024","Mon Oct 21 07:58:44 GMT 2024","1","createSchema","","","","","userSelected should create schema correctly",""
"passed","Mon Oct 21 07:58:40 GMT 2024","Mon Oct 21 07:58:40 GMT 2024","1","convertFieldValue","","","","","[12] convert MULTI_SELECT field correctly",""
"passed","Mon Oct 21 07:58:40 GMT 2024","Mon Oct 21 07:58:40 GMT 2024","0","convertFieldValue","","","","","[18] convert FILE field correctly",""
"passed","Mon Oct 21 07:58:42 GMT 2024","Mon Oct 21 07:58:43 GMT 2024","269","main","","","","","should throw error when required arguments are missing",""
"passed","Mon Oct 21 08:00:42 GMT 2024","Mon Oct 21 08:00:55 GMT 2024","12981","","CliKintoneTest-39 Should import the records successfully with multiple attachments on different records.","","","","CliKintoneTest-39 Should import the records successfully with multiple attachments on different records.",""
"passed","Mon Oct 21 07:58:44 GMT 2024","Mon Oct 21 07:58:44 GMT 2024","2","utils/operateFilename.ts","","","","","should replace a special character",""
"passed","Mon Oct 21 07:58:39 GMT 2024","Mon Oct 21 07:58:39 GMT 2024","1","api","","","","","should prioritize username and password over apiToken",""
"passed","Mon Oct 21 08:01:28 GMT 2024","Mon Oct 21 08:01:28 GMT 2024","681","","CliKintoneTest-110 Should return the error message when exporting the record with incorrect --guest-space-id","","","","CliKintoneTest-110 Should return the error message when exporting the record with incorrect --guest-space-id",""
"passed","Mon Oct 21 07:58:43 GMT 2024","Mon Oct 21 07:58:43 GMT 2024","4","File Generator functions","","","","","should throw error when generating unsupported file extension",""
"passed","Mon Oct 21 07:58:43 GMT 2024","Mon Oct 21 07:58:43 GMT 2024","1","File Generator functions","","","","","should throw error when file path is invalid",""
"passed","Mon Oct 21 08:01:44 GMT 2024","Mon Oct 21 08:01:48 GMT 2024","3550","","CliKintoneTest-48 Should return the error message when upserting with a non-prohibit duplicate values Number field.","","","","CliKintoneTest-48 Should return the error message when upserting with a non-prohibit duplicate values Number field.",""
"passed","Mon Oct 21 07:58:40 GMT 2024","Mon Oct 21 07:58:40 GMT 2024","1","Helper functions","replacePlaceholders","","","","should replace placeholders correctly",""
"passed","Mon Oct 21 07:58:39 GMT 2024","Mon Oct 21 07:58:39 GMT 2024","2","upsertRecords","","","","","should upsert records correctly with record number on kintone has app code",""
"passed","Mon Oct 21 07:58:40 GMT 2024","Mon Oct 21 07:58:40 GMT 2024","1","convertFieldValue","","","","","[4] convert NUMBER field correctly",""
"passed","Mon Oct 21 08:00:14 GMT 2024","Mon Oct 21 08:00:18 GMT 2024","3317","","CliKintoneTest-140 Should return the error message when deleting records with non-existent record number.","","","","CliKintoneTest-140 Should return the error message when deleting records with non-existent record number.",""
"passed","Mon Oct 21 08:01:18 GMT 2024","Mon Oct 21 08:01:19 GMT 2024","1239","","CliKintoneTest-103 Should return the error message when exporting records with --fields specified, including fields within a table.","","","","CliKintoneTest-103 Should return the error message when exporting records with --fields specified, including fields within a table.",""
"passed","Mon Oct 21 07:58:41 GMT 2024","Mon Oct 21 07:58:41 GMT 2024","3","validateRecordNumbers","","","","","should throw error when the record number is invalid",""
"passed","Mon Oct 21 07:58:39 GMT 2024","Mon Oct 21 07:58:39 GMT 2024","2","upsertRecords","","","","","should throw error when unsupported field is passed as update key",""
"passed","Mon Oct 21 08:00:03 GMT 2024","Mon Oct 21 08:00:04 GMT 2024","723","","CliKintoneTest-138 Should return the error message when deleting records with an unsupported file.","","","","CliKintoneTest-138 Should return the error message when deleting records with an unsupported file.",""
"passed","Mon Oct 21 07:58:40 GMT 2024","Mon Oct 21 07:58:40 GMT 2024","2","parseKintoneRestAPIError","","","","","should return parsed string",""
"passed","Mon Oct 21 07:58:43 GMT 2024","Mon Oct 21 07:58:43 GMT 2024","1","createSchema","","","","","userSelected should create schema correctly",""
"passed","Mon Oct 21 07:58:39 GMT 2024","Mon Oct 21 07:58:39 GMT 2024","1","api","","","","","should pass information of client certificate to the apiClient correctly",""
"passed","Mon Oct 21 07:58:43 GMT 2024","Mon Oct 21 07:58:43 GMT 2024","2","parseCsv","","","","","should convert csv string to JSON correctly (CRLF)",""
"failed","Mon Oct 21 07:59:45 GMT 2024","Mon Oct 21 07:59:46 GMT 2024","623","","CliKintoneTest-27 Should return the error message when importing records with valid and invalid API Tokens.","","","","CliKintoneTest-27 Should return the error message when importing records with valid and invalid API Tokens.",""
"passed","Mon Oct 21 07:58:40 GMT 2024","Mon Oct 21 07:58:40 GMT 2024","13","getAllRecords","","","","","should pass parameters to the apiClient correctly (without orderBy)",""
"passed","Mon Oct 21 07:58:40 GMT 2024","Mon Oct 21 07:58:40 GMT 2024","1","convertFieldValue","","","","","[29] convert STATUS_ASSIGNEE field correctly",""
"passed","Mon Oct 21 07:59:24 GMT 2024","Mon Oct 21 07:59:26 GMT 2024","1955","","CliKintoneTest-78 Should return the error message when the user has no privilege to view records.","","","","CliKintoneTest-78 Should return the error message when the user has no privilege to view records.",""
"passed","Mon Oct 21 08:01:56 GMT 2024","Mon Oct 21 08:02:00 GMT 2024","4572","","CliKintoneTest-51 Should import the records successfully with --fields specified.","","","","CliKintoneTest-51 Should import the records successfully with --fields specified.",""
"passed","Mon Oct 21 08:01:37 GMT 2024","Mon Oct 21 08:01:43 GMT 2024","6668","","CliKintoneTest-170 Should not delete the records when pressing Enter (without a specific answer) in the confirmation prompt.","","","","CliKintoneTest-170 Should not delete the records when pressing Enter (without a specific answer) in the confirmation prompt.",""
"passed","Mon Oct 21 07:58:41 GMT 2024","Mon Oct 21 07:58:41 GMT 2024","2","DeleteAllRecordsError","","","","","should return error message",""
"passed","Mon Oct 21 07:58:40 GMT 2024","Mon Oct 21 07:58:40 GMT 2024","1","Helper functions","compareBuffers","","","","should return TRUE if two buffers are the same",""
"passed","Mon Oct 21 07:58:43 GMT 2024","Mon Oct 21 07:58:43 GMT 2024","12","readFile","","","","","can detect file format correctly",""
"passed","Mon Oct 21 07:58:39 GMT 2024","Mon Oct 21 07:58:39 GMT 2024","2","upsertRecords","","","","","should upsert records correctly with number",""
"passed","Mon Oct 21 07:58:40 GMT 2024","Mon Oct 21 07:58:40 GMT 2024","0","convertFieldValue","","","","","[8] convert LINK field correctly",""
"passed","Mon Oct 21 07:59:29 GMT 2024","Mon Oct 21 07:59:29 GMT 2024","628","","CliKintoneTest-15 Should return the error message when the API token is incorrect","","","","CliKintoneTest-15 Should return the error message when the API token is incorrect",""
"passed","Mon Oct 21 07:58:41 GMT 2024","Mon Oct 21 07:58:41 GMT 2024","1","csvStringifier","","","","","should convert empty array to csv string correctly",""
"passed","Mon Oct 21 07:58:40 GMT 2024","Mon Oct 21 07:58:40 GMT 2024","1","convertFieldValue","","","","","[26] convert GROUP_SELECT field correctly",""
"passed","Mon Oct 21 07:59:26 GMT 2024","Mon Oct 21 07:59:26 GMT 2024","101","","CliKintoneTest-8 Should return the error message when the protocol of baseUrl is not HTTPS","","","","CliKintoneTest-8 Should return the error message when the protocol of baseUrl is not HTTPS",""
"passed","Mon Oct 21 08:01:29 GMT 2024","Mon Oct 21 08:01:33 GMT 2024","3555","","CliKintoneTest-46 Should return the error message when upserting with a non-prohibit duplicate values Text field.","","","","CliKintoneTest-46 Should return the error message when upserting with a non-prohibit duplicate values Text field.",""
"passed","Mon Oct 21 07:58:41 GMT 2024","Mon Oct 21 07:58:41 GMT 2024","6","deleteRecords","","","","","should throw error when API response is error",""
"passed","Mon Oct 21 07:59:26 GMT 2024","Mon Oct 21 07:59:26 GMT 2024","100","","CliKintoneTest-9 Should return the error message when the baseUrl is not URL format","","","","CliKintoneTest-9 Should return the error message when the baseUrl is not URL format",""
"passed","Mon Oct 21 07:58:40 GMT 2024","Mon Oct 21 07:58:40 GMT 2024","1","convertFieldValue","","","","","[18] convert TIME field correctly",""
"passed","Mon Oct 21 07:58:39 GMT 2024","Mon Oct 21 07:58:39 GMT 2024","8","addRecords","","","","","should not fail",""
"passed","Mon Oct 21 08:00:40 GMT 2024","Mon Oct 21 08:00:42 GMT 2024","1932","","CliKintoneTest-143 Should return the error message when deleting records with incorrect App Code.","","","","CliKintoneTest-143 Should return the error message when deleting records with incorrect App Code.",""
"passed","Mon Oct 21 08:00:36 GMT 2024","Mon Oct 21 08:00:43 GMT 2024","7786","","CliKintoneTest-94 Should return the record contents and download attachments successfully with a TXT file.","","","","CliKintoneTest-94 Should return the record contents and download attachments successfully with a TXT file.",""
"passed","Mon Oct 21 07:59:25 GMT 2024","Mon Oct 21 07:59:29 GMT 2024","4567","","CliKintoneTest-23 Should import the records with API Token successfully.","","","","CliKintoneTest-23 Should import the records with API Token successfully.",""
"passed","Mon Oct 21 07:58:40 GMT 2024","Mon Oct 21 07:58:40 GMT 2024","1","convertFieldValue","","","","","[8] convert CALC field correctly",""
"passed","Mon Oct 21 07:59:25 GMT 2024","Mon Oct 21 07:59:26 GMT 2024","643","","CliKintoneTest-6 Should return the error message when the baseUrl is non-existent subdomain","","","","CliKintoneTest-6 Should return the error message when the baseUrl is non-existent subdomain",""
"passed","Mon Oct 21 07:58:43 GMT 2024","Mon Oct 21 07:58:43 GMT 2024","3","stringifier","","","","","should stringify records as csv correctly",""
"passed","Mon Oct 21 07:58:40 GMT 2024","Mon Oct 21 07:58:40 GMT 2024","5","convertFieldValue","","","","","[21] convert USER_SELECT field correctly",""
"passed","Mon Oct 21 07:58:41 GMT 2024","Mon Oct 21 07:58:41 GMT 2024","2","deleteAllRecords","","","","","should throw error when API response is error",""
"passed","Mon Oct 21 07:58:40 GMT 2024","Mon Oct 21 07:58:40 GMT 2024","1","CliKintoneError","","","","","toStringCause should output the correct sentence. (inner: KintoneRestAPIError)",""
"passed","Mon Oct 21 08:01:05 GMT 2024","Mon Oct 21 08:01:16 GMT 2024","11262","","CliKintoneTest-152 Should delete the records successfully with an encoded sjis CSV file, and --encoding option is sjis.","","","","CliKintoneTest-152 Should delete the records successfully with an encoded sjis CSV file, and --encoding option is sjis.",""
"passed","Mon Oct 21 07:58:40 GMT 2024","Mon Oct 21 07:58:40 GMT 2024","3","convertFieldValue","","","","","[0] convert RECORD_NUMBER field correctly",""
"passed","Mon Oct 21 08:00:53 GMT 2024","Mon Oct 21 08:00:54 GMT 2024","718","","CliKintoneTest-150 Should return the error message when deleting records with incorrect guest space ID.","","","","CliKintoneTest-150 Should return the error message when deleting records with incorrect guest space ID.",""
"passed","Mon Oct 21 07:59:26 GMT 2024","Mon Oct 21 07:59:26 GMT 2024","119","","CliKintoneTest-10 Should return the error message when lacking of --app option","","","","CliKintoneTest-10 Should return the error message when lacking of --app option",""
"passed","Mon Oct 21 07:58:41 GMT 2024","Mon Oct 21 07:58:41 GMT 2024","1","validateRecordNumbers","","","","","should throw error when the record number is duplicated",""
"passed","Mon Oct 21 07:58:40 GMT 2024","Mon Oct 21 07:58:40 GMT 2024","1","convertFieldValue","","","","","[14] convert CREATOR field correctly",""
"passed","Mon Oct 21 07:58:40 GMT 2024","Mon Oct 21 07:58:40 GMT 2024","1","convertFieldValue","","","","","[19] convert FILE field correctly",""
"passed","Mon Oct 21 07:58:40 GMT 2024","Mon Oct 21 07:58:40 GMT 2024","1","convertFieldValue","","","","","[2] convert RADIO_BUTTON field correctly",""
"passed","Mon Oct 21 07:58:41 GMT 2024","Mon Oct 21 07:58:41 GMT 2024","1","validateRecordNumbers","","","","","should throw error when the record number is empty",""
"passed","Mon Oct 21 07:58:38 GMT 2024","Mon Oct 21 07:58:38 GMT 2024","3","getRecords","","","","","should show warning message if there is no records exist in the app or match the condition.",""
"passed","Mon Oct 21 07:58:41 GMT 2024","Mon Oct 21 07:58:41 GMT 2024","1","Record - Subcommand","getArgumentsListBySubcommand","","","","should return the arguments list of the record delete correctly",""
"passed","Mon Oct 21 07:58:39 GMT 2024","Mon Oct 21 07:58:39 GMT 2024","1","api","","","","","should pass basic auth params to the apiClient correctly",""
"passed","Mon Oct 21 08:02:13 GMT 2024","Mon Oct 21 08:02:18 GMT 2024","4676","","CliKintoneTest-60 Should import the records successfully with the correct guest space id.","","","","CliKintoneTest-60 Should import the records successfully with the correct guest space id.",""
"passed","Mon Oct 21 07:58:43 GMT 2024","Mon Oct 21 07:58:43 GMT 2024","2","parseCsv","","","","","should convert csv string with no record to JSON correctly",""
"passed","Mon Oct 21 07:58:41 GMT 2024","Mon Oct 21 07:58:41 GMT 2024","3","Record - Subcommand","getArgumentsListBySubcommand","","","","should return the arguments list of the record import correctly",""
"passed","Mon Oct 21 07:58:40 GMT 2024","Mon Oct 21 07:58:40 GMT 2024","1","convertFieldValue","","","","","[17] convert CHECK_BOX field correctly",""
"passed","Mon Oct 21 07:59:47 GMT 2024","Mon Oct 21 07:59:50 GMT 2024","3105","","CliKintoneTest-29 Should return the error message when updating records with an API Token without View/Edit permission.","","","","CliKintoneTest-29 Should return the error message when updating records with an API Token without View/Edit permission.",""
"passed","Mon Oct 21 07:58:40 GMT 2024","Mon Oct 21 07:58:40 GMT 2024","1","Record command","Valid parameters","","","","should return the import query correctly",""
"passed","Mon Oct 21 07:59:41 GMT 2024","Mon Oct 21 07:59:43 GMT 2024","1771","","CliKintoneTest-83 Should return the error message when exporting the record with a non-relevant API Token.","","","","CliKintoneTest-83 Should return the error message when exporting the record with a non-relevant API Token.",""
"passed","Mon Oct 21 07:58:41 GMT 2024","Mon Oct 21 07:58:41 GMT 2024","1","fieldInSubtableReader","","","","","missing field value",""
"passed","Mon Oct 21 07:58:41 GMT 2024","Mon Oct 21 07:58:41 GMT 2024","3","buildHeaderFields","","","","","should generate fieldCode array correctly (data without subtable)",""
"passed","Mon Oct 21 07:58:41 GMT 2024","Mon Oct 21 07:58:41 GMT 2024","2","ProgressLogger","","","","","should show progress logs correctly",""
"passed","Mon Oct 21 07:58:40 GMT 2024","Mon Oct 21 07:58:40 GMT 2024","1","convertFieldValue","","","","","[3] convert UPDATED_TIME field correctly",""
"passed","Mon Oct 21 07:59:26 GMT 2024","Mon Oct 21 07:59:31 GMT 2024","4757","","CliKintoneTest-79 Should return the record contents in CSV format of the app in a space.","","","","CliKintoneTest-79 Should return the record contents in CSV format of the app in a space.",""
"passed","Mon Oct 21 07:58:43 GMT 2024","Mon Oct 21 07:58:43 GMT 2024","4","createSchema","","","","","formLayout should create schema correctly",""
"passed","Mon Oct 21 07:59:46 GMT 2024","Mon Oct 21 07:59:47 GMT 2024","625","","CliKintoneTest-131 Should return the error message when deleting records with two valid API Token.","","","","CliKintoneTest-131 Should return the error message when deleting records with two valid API Token.",""
"passed","Mon Oct 21 08:00:18 GMT 2024","Mon Oct 21 08:00:29 GMT 2024","10589","","CliKintoneTest-37 Should import the records successfully with multiple attachments on a field.","","","","CliKintoneTest-37 Should import the records successfully with multiple attachments on a field.",""
"passed","Mon Oct 21 07:58:43 GMT 2024","Mon Oct 21 07:58:43 GMT 2024","6","parseCsv","","","","","should convert subtable included csv string to JSON correctly",""
"passed","Mon Oct 21 07:58:38 GMT 2024","Mon Oct 21 07:58:38 GMT 2024","2","getRecords","","","","","can get records",""
"passed","Mon Oct 21 07:58:42 GMT 2024","Mon Oct 21 07:58:42 GMT 2024","267","main","","","","","should throw error when an undefined argument is passed",""
"passed","Mon Oct 21 07:58:44 GMT 2024","Mon Oct 21 07:58:44 GMT 2024","0","ParserError","","","","","should be constructed with CsvError",""
"passed","Mon Oct 21 08:01:17 GMT 2024","Mon Oct 21 08:01:17 GMT 2024","112","","CliKintoneTest-155 Should return the error message when specifying an unsupported encoding.","","","","CliKintoneTest-155 Should return the error message when specifying an unsupported encoding.",""
"passed","Mon Oct 21 07:58:41 GMT 2024","Mon Oct 21 07:58:41 GMT 2024","1","UpsertRecordsError","","","","","should return error message",""
"passed","Mon Oct 21 07:58:39 GMT 2024","Mon Oct 21 07:58:39 GMT 2024","1","api","","","","","should pass guestSpaceId to the apiClient correctly",""
"passed","Mon Oct 21 07:58:40 GMT 2024","Mon Oct 21 07:58:40 GMT 2024","0","convertFieldValue","","","","","[7] convert RICH_TEXT field correctly",""
"passed","Mon Oct 21 07:58:43 GMT 2024","Mon Oct 21 07:58:43 GMT 2024","2","parseCsv","","","","","should convert empty csv string to JSON correctly",""
"passed","Mon Oct 21 07:58:43 GMT 2024","Mon Oct 21 07:58:43 GMT 2024","1","logHandler","","","","","should set ""trace"" to the log config level when log-level argument is ""trace""",""
"passed","Mon Oct 21 07:58:40 GMT 2024","Mon Oct 21 07:58:40 GMT 2024","1","convertFieldValue","","","","","[1] convert SINGLE_LINE_TEXT field correctly",""
"passed","Mon Oct 21 07:58:40 GMT 2024","Mon Oct 21 07:58:40 GMT 2024","1","userSelected","","","","","should throw an Error if specified field does not exist",""
"passed","Mon Oct 21 07:58:43 GMT 2024","Mon Oct 21 07:58:43 GMT 2024","1","hasAppCode","","","","","should pass (input: 123, appCode: , result: false)",""
"passed","Mon Oct 21 07:58:44 GMT 2024","Mon Oct 21 07:58:44 GMT 2024","2","parseCsv","","","","","should return the correct record number from CSV without subtable",""
"passed","Mon Oct 21 07:58:40 GMT 2024","Mon Oct 21 07:58:40 GMT 2024","1","withIndexIterator","","","","","can iterate from data source with index",""
"passed","Mon Oct 21 07:58:40 GMT 2024","Mon Oct 21 07:58:40 GMT 2024","1","StandardLogger","","","","","should display ERROR message when calling logger with ""error"" level",""
"passed","Mon Oct 21 07:58:43 GMT 2024","Mon Oct 21 07:58:43 GMT 2024","1","readFile","","","","","can read utf8 encoded csv file correctly",""
"passed","Mon Oct 21 07:58:39 GMT 2024","Mon Oct 21 07:58:39 GMT 2024","2","upsertRecords","","","","","should upsert records correctly with single line text",""
"passed","Mon Oct 21 07:58:43 GMT 2024","Mon Oct 21 07:58:43 GMT 2024","3","readFile","","","","","throws error if format is JSON and encoding is not 'utf8'",""
"passed","Mon Oct 21 08:00:02 GMT 2024","Mon Oct 21 08:00:10 GMT 2024","7675","","CliKintoneTest-90 Should return the record contents and download attachments successfully to an existing directory.","","","","CliKintoneTest-90 Should return the record contents and download attachments successfully to an existing directory.",""
"passed","Mon Oct 21 07:59:31 GMT 2024","Mon Oct 21 07:59:35 GMT 2024","4509","","CliKintoneTest-21 Should import records to app in space successfully.","","","","CliKintoneTest-21 Should import records to app in space successfully.",""
"passed","Mon Oct 21 07:58:40 GMT 2024","Mon Oct 21 07:58:40 GMT 2024","2","groupByKeyChunked","","","","","can separate date source by group and chunked",""
"passed","Mon Oct 21 07:58:43 GMT 2024","Mon Oct 21 07:58:43 GMT 2024","7","File Generator functions","Generate file success","","","","should generate file correctly",""
"passed","Mon Oct 21 08:01:16 GMT 2024","Mon Oct 21 08:01:16 GMT 2024","119","","CliKintoneTest-153 Should return the error message when specifying an encoded sjis CSV file, and --encoding option is utf8.","","","","CliKintoneTest-153 Should return the error message when specifying an encoded sjis CSV file, and --encoding option is utf8.",""
"passed","Mon Oct 21 07:59:25 GMT 2024","Mon Oct 21 07:59:25 GMT 2024","100","","CliKintoneTest-4 Should return the help description by --help","","","","CliKintoneTest-4 Should return the help description by --help",""
