"DESCRIPTION","DURATION IN MS","NAME","PARENT SUITE","START TIME","STATUS","STOP TIME","SUB SUITE","SUITE","TEST CLASS","TEST METHOD"
"","1","should filter http(s) path","sourcelist","Fri Nov 14 22:38:31 UTC 2025","passed","Fri Nov 14 22:38:31 UTC 2025","","","",""
"","1","should throw error because the record numbers are mixed with those with and without app code","upsertRecords","Fri Nov 14 22:38:30 UTC 2025","passed","Fri Nov 14 22:38:30 UTC 2025","","","",""
"","10243","Upsert by record number","","Fri Nov 14 22:44:52 UTC 2025","passed","Fri Nov 14 22:45:02 UTC 2025","","Upsert by record number","",""
"","741","Valid and invalid API tokens","","Fri Nov 14 22:43:31 UTC 2025","passed","Fri Nov 14 22:43:32 UTC 2025","","Valid and invalid API tokens","",""
"","4514","API tokens for different apps","","Fri Nov 14 22:43:27 UTC 2025","passed","Fri Nov 14 22:43:31 UTC 2025","","API tokens for different apps","",""
"","9049","Record has multiple attachments","","Fri Nov 14 22:44:13 UTC 2025","passed","Fri Nov 14 22:44:23 UTC 2025","","Record has multiple attachments","",""
"","1","[29] convert STATUS_ASSIGNEE field correctly","convertFieldValue","Fri Nov 14 22:38:29 UTC 2025","passed","Fri Nov 14 22:38:29 UTC 2025","","","",""
"","4","should throw error when generating unsupported file extension","File Generator functions","Fri Nov 14 22:38:32 UTC 2025","passed","Fri Nov 14 22:38:32 UTC 2025","","","",""
"","758","API token is a draft","","Fri Nov 14 22:43:25 UTC 2025","passed","Fri Nov 14 22:43:26 UTC 2025","","API token is a draft","",""
"","767","Record number is not specified in a file","","Fri Nov 14 22:45:28 UTC 2025","passed","Fri Nov 14 22:45:29 UTC 2025","","Record number is not specified in a file","",""
"","1","should return the correct record number from CSV with subtable","parseCsv","Fri Nov 14 22:38:35 UTC 2025","passed","Fri Nov 14 22:38:35 UTC 2025","","","",""
"","1","number","hex2a","Fri Nov 14 22:38:35 UTC 2025","passed","Fri Nov 14 22:38:35 UTC 2025","","","",""
"","0","[18] convert TIME field correctly","convertFieldValue","Fri Nov 14 22:38:30 UTC 2025","passed","Fri Nov 14 22:38:30 UTC 2025","","","",""
"","0","[8] convert CALC field correctly","convertFieldValue","Fri Nov 14 22:38:29 UTC 2025","passed","Fri Nov 14 22:38:29 UTC 2025","","","",""
"","2","should stringify records as csv correctly (iterative)","stringifier","Fri Nov 14 22:38:35 UTC 2025","passed","Fri Nov 14 22:38:35 UTC 2025","","","",""
"","4777","API token does not have delete permission","","Fri Nov 14 22:43:10 UTC 2025","passed","Fri Nov 14 22:43:14 UTC 2025","","API token does not have delete permission","",""
"","4828","App in a space","","Fri Nov 14 22:43:16 UTC 2025","passed","Fri Nov 14 22:43:21 UTC 2025","","App in a space","",""
"","1","should throw error when the field specified in schema does not exist on input record","upsertRecords","Fri Nov 14 22:38:30 UTC 2025","passed","Fri Nov 14 22:38:30 UTC 2025","","","",""
"","1","should convert csv string with no record to JSON correctly","parseCsv","Fri Nov 14 22:38:34 UTC 2025","passed","Fri Nov 14 22:38:34 UTC 2025","","","",""
"","0","[15] convert DATE field correctly","convertFieldValue","Fri Nov 14 22:38:30 UTC 2025","passed","Fri Nov 14 22:38:30 UTC 2025","","","",""
"","1","should set ""error"" to the log config level when log-level argument is ""error""","logHandler","Fri Nov 14 22:38:35 UTC 2025","passed","Fri Nov 14 22:38:35 UTC 2025","","","",""
"","3224","Continue uploading by pressing ""Y""","","Fri Nov 14 22:43:19 UTC 2025","passed","Fri Nov 14 22:43:22 UTC 2025","","Continue uploading by pressing ""Y""","",""
"","2","can get records","getRecords","Fri Nov 14 22:38:29 UTC 2025","passed","Fri Nov 14 22:38:29 UTC 2025","","","",""
"","1","should convert kintone records to csv string correctly when FILE included and with attachmentsDir option","csvStringifier","Fri Nov 14 22:38:32 UTC 2025","passed","Fri Nov 14 22:38:32 UTC 2025","","","",""
"","2048","Specify a field in a table","","Fri Nov 14 22:45:49 UTC 2025","passed","Fri Nov 14 22:45:51 UTC 2025","","Specify a field in a table","",""
"","1","should throw error when file path is invalid","File Generator functions","Fri Nov 14 22:38:32 UTC 2025","passed","Fri Nov 14 22:38:32 UTC 2025","","","",""
"","1","should replace a special character","utils/operateFilename.ts","Fri Nov 14 22:38:35 UTC 2025","passed","Fri Nov 14 22:38:35 UTC 2025","","","",""
"","1","should return the arguments list of the record delete correctly","Record - Subcommand","Fri Nov 14 22:38:32 UTC 2025","passed","Fri Nov 14 22:38:32 UTC 2025","","getArgumentsListBySubcommand","",""
"","1","can generate expected uuid from the private key","PrivateKey","Fri Nov 14 22:38:34 UTC 2025","passed","Fri Nov 14 22:38:34 UTC 2025","","","",""
"","1","should throw error when missing required argument","Record command","Fri Nov 14 22:38:31 UTC 2025","passed","Fri Nov 14 22:38:31 UTC 2025","","Missing required parameters","",""
"","173","Specify utf8 with sjis encoded file","","Fri Nov 14 22:45:01 UTC 2025","passed","Fri Nov 14 22:45:01 UTC 2025","","Specify utf8 with sjis encoded file","",""
"","1","should pass guestSpaceId to the apiClient correctly","api","Fri Nov 14 22:38:29 UTC 2025","passed","Fri Nov 14 22:38:29 UTC 2025","","","",""
"","2","should pass parameters to the apiClient correctly","deleteRecords","Fri Nov 14 22:38:31 UTC 2025","passed","Fri Nov 14 22:38:31 UTC 2025","","","",""
"","1499","App does not have records","","Fri Nov 14 22:45:02 UTC 2025","passed","Fri Nov 14 22:45:04 UTC 2025","","App does not have records","",""
"","2","should repeat given function after delay on error and return result on resolve","retry","Fri Nov 14 22:38:30 UTC 2025","passed","Fri Nov 14 22:38:30 UTC 2025","","input async function","",""
"","3988","Specify a table","","Fri Nov 14 22:45:05 UTC 2025","passed","Fri Nov 14 22:45:09 UTC 2025","","Specify a table","",""
"","652","Display plugin info in JSON format","","Fri Nov 14 22:43:10 UTC 2025","passed","Fri Nov 14 22:43:10 UTC 2025","","Display plugin info in JSON format","",""
"","5","should throw error when the record number field code is not found","ParserError","Fri Nov 14 22:38:35 UTC 2025","passed","Fri Nov 14 22:38:35 UTC 2025","","","",""
"","1","should convert empty array to csv string correctly","csvStringifier","Fri Nov 14 22:38:32 UTC 2025","passed","Fri Nov 14 22:38:32 UTC 2025","","","",""
"","5","should upsert records correctly with record numbers on local and kintone have app code","upsertRecords","Fri Nov 14 22:38:30 UTC 2025","passed","Fri Nov 14 22:38:30 UTC 2025","","","",""
"","691","Valid and invalid API tokens","","Fri Nov 14 22:43:38 UTC 2025","passed","Fri Nov 14 22:43:39 UTC 2025","","Valid and invalid API tokens","",""
"","1","[27] convert GROUP_SELECT field correctly","convertFieldValue","Fri Nov 14 22:38:30 UTC 2025","passed","Fri Nov 14 22:38:30 UTC 2025","","","",""
"","1","should convert empty csv string to JSON correctly","parseCsv","Fri Nov 14 22:38:34 UTC 2025","passed","Fri Nov 14 22:38:34 UTC 2025","","","",""
"","4584","Condition query - short option","","Fri Nov 14 22:44:39 UTC 2025","passed","Fri Nov 14 22:44:44 UTC 2025","","Condition query - short option","",""
"","5","should convert kintone records to csv string correctly","csvStringifier","Fri Nov 14 22:38:32 UTC 2025","passed","Fri Nov 14 22:38:32 UTC 2025","","","",""
"","1","can read utf8 encoded csv file correctly","readFile","Fri Nov 14 22:38:35 UTC 2025","passed","Fri Nov 14 22:38:35 UTC 2025","","","",""
"","9","should not fail","addRecords","Fri Nov 14 22:38:29 UTC 2025","passed","Fri Nov 14 22:38:29 UTC 2025","","","",""
"","2","should throw error when attachmentsDir is NOT given","addRecords","Fri Nov 14 22:38:29 UTC 2025","passed","Fri Nov 14 22:38:29 UTC 2025","","","",""
"","3422","Upload plugin.zip","","Fri Nov 14 22:43:10 UTC 2025","passed","Fri Nov 14 22:43:13 UTC 2025","","Upload plugin.zip","",""
"","4122","Utf8 encoded file","","Fri Nov 14 22:46:02 UTC 2025","passed","Fri Nov 14 22:46:06 UTC 2025","","Utf8 encoded file","",""
"","1","[24] convert ORGANIZATION_SELECT field correctly","convertFieldValue","Fri Nov 14 22:38:30 UTC 2025","passed","Fri Nov 14 22:38:30 UTC 2025","","","",""
"","649","Pack a plugin","","Fri Nov 14 22:43:09 UTC 2025","passed","Fri Nov 14 22:43:10 UTC 2025","","Pack a plugin","",""
"","46","`url`","validate","Fri Nov 14 22:38:32 UTC 2025","passed","Fri Nov 14 22:38:32 UTC 2025","","","",""
"","1","should return TRUE if two buffers are the same","Helper functions","Fri Nov 14 22:38:31 UTC 2025","passed","Fri Nov 14 22:38:31 UTC 2025","","compareBuffers","",""
"","1","should throw error when the record number is not exists","validateRecordNumbers","Fri Nov 14 22:38:32 UTC 2025","passed","Fri Nov 14 22:38:32 UTC 2025","","","",""
"","1","should make the file list unique","sourcelist","Fri Nov 14 22:38:31 UTC 2025","passed","Fri Nov 14 22:38:31 UTC 2025","","","",""
"","1","[11] convert DROP_DOWN field correctly","convertFieldValue","Fri Nov 14 22:38:30 UTC 2025","passed","Fri Nov 14 22:38:30 UTC 2025","","","",""
"","0","[27] convert CATEGORY field correctly","convertFieldValue","Fri Nov 14 22:38:29 UTC 2025","passed","Fri Nov 14 22:38:29 UTC 2025","","","",""
"","235","Get help","","Fri Nov 14 22:43:10 UTC 2025","passed","Fri Nov 14 22:43:11 UTC 2025","","Get help","",""
"","1","[16] convert MULTI_SELECT field correctly","convertFieldValue","Fri Nov 14 22:38:29 UTC 2025","passed","Fri Nov 14 22:38:29 UTC 2025","","","",""
"","413","Get version","","Fri Nov 14 22:43:10 UTC 2025","passed","Fri Nov 14 22:43:10 UTC 2025","","Get version","",""
"","2","should generate fieldCode array correctly (data without subtable)","buildHeaderFields","Fri Nov 14 22:38:31 UTC 2025","passed","Fri Nov 14 22:38:31 UTC 2025","","","",""
"","1","should throw error when update key field does not exist on input record","upsertRecords","Fri Nov 14 22:38:30 UTC 2025","passed","Fri Nov 14 22:38:30 UTC 2025","","","",""
"","1","[22] convert USER_SELECT field correctly","convertFieldValue","Fri Nov 14 22:38:30 UTC 2025","passed","Fri Nov 14 22:38:30 UTC 2025","","","",""
"","0","empty field value","fieldInSubtableReader","Fri Nov 14 22:38:31 UTC 2025","passed","Fri Nov 14 22:38:31 UTC 2025","","","",""
"","1","should includes a Record Number field","addRecords","Fri Nov 14 22:38:29 UTC 2025","passed","Fri Nov 14 22:38:29 UTC 2025","","","",""
"","1","should return the delete query correctly","Record command","Fri Nov 14 22:38:31 UTC 2025","passed","Fri Nov 14 22:38:31 UTC 2025","","Valid parameters","",""
"","6329","App has a table","","Fri Nov 14 22:45:23 UTC 2025","passed","Fri Nov 14 22:45:30 UTC 2025","","App has a table","",""
"","160","Unsupported encoding","","Fri Nov 14 22:45:02 UTC 2025","passed","Fri Nov 14 22:45:02 UTC 2025","","Unsupported encoding","",""
"","1","should set ""warn"" to the log config level when log-level argument is ""warn""","logHandler","Fri Nov 14 22:38:35 UTC 2025","passed","Fri Nov 14 22:38:35 UTC 2025","","","",""
"","1","userSelected should create schema correctly with updateKey","createSchema","Fri Nov 14 22:38:35 UTC 2025","passed","Fri Nov 14 22:38:35 UTC 2025","","","",""
"","2","can separate data source by chunk","chunked","Fri Nov 14 22:38:29 UTC 2025","passed","Fri Nov 14 22:38:29 UTC 2025","","","",""
"","1","[3] convert UPDATED_TIME field correctly","convertFieldValue","Fri Nov 14 22:38:30 UTC 2025","passed","Fri Nov 14 22:38:30 UTC 2025","","","",""
"","1353","API token does not have privilege to add records","","Fri Nov 14 22:43:32 UTC 2025","passed","Fri Nov 14 22:43:33 UTC 2025","","API token does not have privilege to add records","",""
"","28","`valid-locales-v1`","validate","Fri Nov 14 22:38:32 UTC 2025","passed","Fri Nov 14 22:38:32 UTC 2025","","","",""
"","2","empty string","hex2a","Fri Nov 14 22:38:35 UTC 2025","passed","Fri Nov 14 22:38:35 UTC 2025","","","",""
"","12","should detect the mismatch encoding correctly","isMismatchEncoding","Fri Nov 14 22:38:35 UTC 2025","passed","Fri Nov 14 22:38:35 UTC 2025","","","",""
"","1","can iterate from data source with index","withIndexIterator","Fri Nov 14 22:38:29 UTC 2025","passed","Fri Nov 14 22:38:29 UTC 2025","","","",""
"","10750","Specify without app code","","Fri Nov 14 22:44:15 UTC 2025","passed","Fri Nov 14 22:44:26 UTC 2025","","Specify without app code","",""
"","3489","Update-key field is not set to unique (text)","","Fri Nov 14 22:45:13 UTC 2025","passed","Fri Nov 14 22:45:16 UTC 2025","","Update-key field is not set to unique (text)","",""
"","165","Unsupported encoding","","Fri Nov 14 22:45:23 UTC 2025","passed","Fri Nov 14 22:45:23 UTC 2025","","Unsupported encoding","",""
"","1","should upsert records correctly with single line text","upsertRecords","Fri Nov 14 22:38:30 UTC 2025","passed","Fri Nov 14 22:38:30 UTC 2025","","","",""
"","8","can read sjis encoded csv file correctly","readFile","Fri Nov 14 22:38:35 UTC 2025","passed","Fri Nov 14 22:38:35 UTC 2025","","","",""
"","0","[5] convert NUMBER field correctly","convertFieldValue","Fri Nov 14 22:38:30 UTC 2025","passed","Fri Nov 14 22:38:30 UTC 2025","","","",""
"","439","Unknown subcommand","","Fri Nov 14 22:43:10 UTC 2025","passed","Fri Nov 14 22:43:10 UTC 2025","","Unknown subcommand","",""
"","161","File path is not specified","","Fri Nov 14 22:43:49 UTC 2025","passed","Fri Nov 14 22:43:49 UTC 2025","","File path is not specified","",""
"","165","No app option","","Fri Nov 14 22:43:12 UTC 2025","passed","Fri Nov 14 22:43:12 UTC 2025","","No app option","",""
"","3","should not throw error","validateRecordNumbers","Fri Nov 14 22:38:32 UTC 2025","passed","Fri Nov 14 22:38:32 UTC 2025","","","",""
"","3","should show warning message if there is no records exist in the app or match the condition.","getRecords","Fri Nov 14 22:38:29 UTC 2025","passed","Fri Nov 14 22:38:29 UTC 2025","","","",""
"","4623","Specify multiple fields","","Fri Nov 14 22:45:43 UTC 2025","passed","Fri Nov 14 22:45:47 UTC 2025","","Specify multiple fields","",""
"","1","should throw error when the record number is empty","validateRecordNumbers","Fri Nov 14 22:38:32 UTC 2025","passed","Fri Nov 14 22:38:32 UTC 2025","","","",""
"","0","[25] convert GROUP_SELECT field correctly","convertFieldValue","Fri Nov 14 22:38:29 UTC 2025","passed","Fri Nov 14 22:38:29 UTC 2025","","","",""
"","0","[23] convert ORGANIZATION_SELECT field correctly","convertFieldValue","Fri Nov 14 22:38:29 UTC 2025","passed","Fri Nov 14 22:38:29 UTC 2025","","","",""
"","680","No authorization information","","Fri Nov 14 22:43:14 UTC 2025","passed","Fri Nov 14 22:43:15 UTC 2025","","No authorization information","",""
"","4781","Login authorization - short password option","","Fri Nov 14 22:43:45 UTC 2025","passed","Fri Nov 14 22:43:49 UTC 2025","","Login authorization - short password option","",""
"","3","should stringify records as csv correctly","stringifier","Fri Nov 14 22:38:35 UTC 2025","passed","Fri Nov 14 22:38:35 UTC 2025","","","",""
"","694","Valid and invalid API tokens","","Fri Nov 14 22:43:35 UTC 2025","passed","Fri Nov 14 22:43:35 UTC 2025","","Valid and invalid API tokens","",""
"","4626","Sjis encoded file","","Fri Nov 14 22:46:06 UTC 2025","passed","Fri Nov 14 22:46:11 UTC 2025","","Sjis encoded file","",""
"","2","all fields have valid value","fieldInSubtableReader","Fri Nov 14 22:38:31 UTC 2025","passed","Fri Nov 14 22:38:31 UTC 2025","","","",""
"","4","should upload files correctly when attachmentsDir is given and with subtable","addRecords","Fri Nov 14 22:38:29 UTC 2025","passed","Fri Nov 14 22:38:29 UTC 2025","","","",""
"","10362","Update by number field","","Fri Nov 14 22:45:16 UTC 2025","passed","Fri Nov 14 22:45:27 UTC 2025","","Update by number field","",""
"","0","toStringCause should output the correct sentence. (inner: KintoneRestAPIError with GAIA_IL23)","CliKintoneError","Fri Nov 14 22:38:30 UTC 2025","passed","Fri Nov 14 22:38:30 UTC 2025","","","",""
"","4513","Invalid ordering with a non-existent field","","Fri Nov 14 22:44:49 UTC 2025","passed","Fri Nov 14 22:44:53 UTC 2025","","Invalid ordering with a non-existent field","",""
"","6006","Unsupported character for confirmation message","","Fri Nov 14 22:45:16 UTC 2025","passed","Fri Nov 14 22:45:22 UTC 2025","","Unsupported character for confirmation message","",""
"","6643","Press Enter for confirmation message","","Fri Nov 14 22:45:22 UTC 2025","passed","Fri Nov 14 22:45:28 UTC 2025","","Press Enter for confirmation message","",""
"","2","formLayout should create schema correctly without system fields on layout","createSchema","Fri Nov 14 22:38:35 UTC 2025","passed","Fri Nov 14 22:38:35 UTC 2025","","","",""
"","152","Invalid URL format","","Fri Nov 14 22:43:12 UTC 2025","passed","Fri Nov 14 22:43:12 UTC 2025","","Invalid URL format","",""
"","3437","Update-key field is not set to unique (number)","","Fri Nov 14 22:45:27 UTC 2025","passed","Fri Nov 14 22:45:30 UTC 2025","","Update-key field is not set to unique (number)","",""
"","237","the zip passes signature verification","PluginZip","Fri Nov 14 22:38:34 UTC 2025","passed","Fri Nov 14 22:38:34 UTC 2025","","","",""
"","169","App is not specified","","Fri Nov 14 22:43:12 UTC 2025","passed","Fri Nov 14 22:43:12 UTC 2025","","App is not specified","",""
"","5788","Update plugin","","Fri Nov 14 22:43:13 UTC 2025","passed","Fri Nov 14 22:43:19 UTC 2025","","Update plugin","",""
"","3900","Specify a table","","Fri Nov 14 22:45:51 UTC 2025","passed","Fri Nov 14 22:45:55 UTC 2025","","Specify a table","",""
"","212","Unknown option","","Fri Nov 14 22:43:09 UTC 2025","passed","Fri Nov 14 22:43:10 UTC 2025","","Unknown option","",""
"","1","should throw error when the record number is duplicated","validateRecordNumbers","Fri Nov 14 22:38:32 UTC 2025","passed","Fri Nov 14 22:38:32 UTC 2025","","","",""
"","3","should throw error when API response is error","deleteRecords","Fri Nov 14 22:38:31 UTC 2025","passed","Fri Nov 14 22:38:31 UTC 2025","","","",""
"","744","Incorrect API token","","Fri Nov 14 22:43:15 UTC 2025","passed","Fri Nov 14 22:43:15 UTC 2025","","Incorrect API token","",""
"","1","should display the correct log message with multiple lines message","StandardLogger","Fri Nov 14 22:38:31 UTC 2025","passed","Fri Nov 14 22:38:31 UTC 2025","","","",""
"","","can download files including special characters in subTable","getRecords","Fri Nov 14 22:38:29 UTC 2025","skipped","","","","",""
"","0","[23] convert USER_SELECT field correctly","convertFieldValue","Fri Nov 14 22:38:30 UTC 2025","passed","Fri Nov 14 22:38:30 UTC 2025","","","",""
"","401","Display plugin info in plain text format","","Fri Nov 14 22:43:09 UTC 2025","passed","Fri Nov 14 22:43:10 UTC 2025","","Display plugin info in plain text format","",""
"","4","should convert kintone records to csv string correctly when SUBTABLE included with attachmentsDir option","csvStringifier","Fri Nov 14 22:38:32 UTC 2025","passed","Fri Nov 14 22:38:32 UTC 2025","","","",""
"","3","should convert multiple subtables included csv string to JSON correctly","parseCsv","Fri Nov 14 22:38:34 UTC 2025","passed","Fri Nov 14 22:38:34 UTC 2025","","","",""
"","1","should display DEBUG message when calling logger with ""debug"" level","StandardLogger","Fri Nov 14 22:38:31 UTC 2025","passed","Fri Nov 14 22:38:31 UTC 2025","","","",""
"","4460","Specify a field","","Fri Nov 14 22:45:38 UTC 2025","passed","Fri Nov 14 22:45:43 UTC 2025","","Specify a field","",""
"","0","[14] convert CREATOR field correctly","convertFieldValue","Fri Nov 14 22:38:29 UTC 2025","passed","Fri Nov 14 22:38:29 UTC 2025","","","",""
"","3","should throw error when the record number is invalid","validateRecordNumbers","Fri Nov 14 22:38:32 UTC 2025","passed","Fri Nov 14 22:38:32 UTC 2025","","","",""
"","0","should throw an Error if specified field is not supported","userSelected","Fri Nov 14 22:38:31 UTC 2025","passed","Fri Nov 14 22:38:31 UTC 2025","","","",""
"","2","should return result when given function is resolved","retry","Fri Nov 14 22:38:30 UTC 2025","passed","Fri Nov 14 22:38:30 UTC 2025","","input sync function","",""
"","723","Unsupported file type","","Fri Nov 14 22:44:51 UTC 2025","passed","Fri Nov 14 22:44:52 UTC 2025","","Unsupported file type","",""
"","106","should call installPlugin API when the plugin have not been installed on kintone","plugin upload command","Fri Nov 14 22:38:30 UTC 2025","passed","Fri Nov 14 22:38:30 UTC 2025","","","",""
"","2","should return the correct record number from CSV without subtable","parseCsv","Fri Nov 14 22:38:35 UTC 2025","passed","Fri Nov 14 22:38:35 UTC 2025","","","",""
"","","can download files including special characters in subTable","getRecords","Fri Nov 14 22:38:28 UTC 2025","skipped","","","","",""
"","2","should generate file correctly with baseDir","File Generator functions","Fri Nov 14 22:38:32 UTC 2025","passed","Fri Nov 14 22:38:32 UTC 2025","","Generate file success","",""
"","1328","Specified field does not exist","","Fri Nov 14 22:45:02 UTC 2025","passed","Fri Nov 14 22:45:04 UTC 2025","","Specified field does not exist","",""
"","718","Incorrect guest space ID","","Fri Nov 14 22:44:39 UTC 2025","passed","Fri Nov 14 22:44:39 UTC 2025","","Incorrect guest space ID","",""
"","1","missing field value","fieldInSubtableReader","Fri Nov 14 22:38:31 UTC 2025","passed","Fri Nov 14 22:38:31 UTC 2025","","","",""
"","1","userSelected should create schema correctly","createSchema","Fri Nov 14 22:38:35 UTC 2025","passed","Fri Nov 14 22:38:35 UTC 2025","","","",""
"","1","should return result when given function is resolved","retry","Fri Nov 14 22:38:30 UTC 2025","passed","Fri Nov 14 22:38:30 UTC 2025","","input async function","",""
"","5","should throw an Error if specified field is in a Table field","userSelected","Fri Nov 14 22:38:31 UTC 2025","passed","Fri Nov 14 22:38:31 UTC 2025","","","",""
"","2","should generate CSV row correctly","Helper functions","Fri Nov 14 22:38:31 UTC 2025","passed","Fri Nov 14 22:38:31 UTC 2025","","generateCsvRow","",""
"","2","should return error message","DeleteAllRecordsError","Fri Nov 14 22:38:35 UTC 2025","passed","Fri Nov 14 22:38:35 UTC 2025","","","",""
"","2","should repeat given function after delay on error and return result on resolve","retry","Fri Nov 14 22:38:30 UTC 2025","passed","Fri Nov 14 22:38:30 UTC 2025","","input sync function","",""
"","4754","API tokens for different apps","","Fri Nov 14 22:43:30 UTC 2025","passed","Fri Nov 14 22:43:35 UTC 2025","","API tokens for different apps","",""
"","2067","Incorrect guest space","","Fri Nov 14 22:46:00 UTC 2025","passed","Fri Nov 14 22:46:02 UTC 2025","","Incorrect guest space","",""
"","91","can export private key","PrivateKey","Fri Nov 14 22:38:34 UTC 2025","passed","Fri Nov 14 22:38:34 UTC 2025","","","",""
"","1","should replace placeholders correctly","Helper functions","Fri Nov 14 22:38:31 UTC 2025","passed","Fri Nov 14 22:38:31 UTC 2025","","replacePlaceholders","",""
"","5853","API token and login information","","Fri Nov 14 22:43:20 UTC 2025","passed","Fri Nov 14 22:43:26 UTC 2025","","API token and login information","",""
"","4968","Valid ordering","","Fri Nov 14 22:44:44 UTC 2025","passed","Fri Nov 14 22:44:49 UTC 2025","","Valid ordering","",""
"","6212","Cancel the execution by pressing ""N""","","Fri Nov 14 22:45:04 UTC 2025","passed","Fri Nov 14 22:45:10 UTC 2025","","Cancel the execution by pressing ""N""","",""
"","1","should convert kintone records to csv string correctly when FILE included and without attachmentsDir option","csvStringifier","Fri Nov 14 22:38:32 UTC 2025","passed","Fri Nov 14 22:38:32 UTC 2025","","","",""
"","7707","Download attachments into an existing directory","","Fri Nov 14 22:43:49 UTC 2025","passed","Fri Nov 14 22:43:57 UTC 2025","","Download attachments into an existing directory","",""
"","30","`https-url`","validate","Fri Nov 14 22:38:32 UTC 2025","passed","Fri Nov 14 22:38:32 UTC 2025","","","",""
"","7406","Record has a .txt file attachment","","Fri Nov 14 22:44:23 UTC 2025","passed","Fri Nov 14 22:44:30 UTC 2025","","Record has a .txt file attachment","",""
"","12","can detect file format correctly","readFile","Fri Nov 14 22:38:35 UTC 2025","passed","Fri Nov 14 22:38:35 UTC 2025","","","",""
"","4673","Specify multiple fields","","Fri Nov 14 22:44:58 UTC 2025","passed","Fri Nov 14 22:45:02 UTC 2025","","Specify multiple fields","",""
"","1","should pass apiToken to the apiClient correctly","api","Fri Nov 14 22:38:29 UTC 2025","passed","Fri Nov 14 22:38:29 UTC 2025","","","",""
"","0","[2] convert MODIFIER field correctly","convertFieldValue","Fri Nov 14 22:38:30 UTC 2025","passed","Fri Nov 14 22:38:30 UTC 2025","","","",""
"","1816","API token for different app","","Fri Nov 14 22:43:27 UTC 2025","passed","Fri Nov 14 22:43:29 UTC 2025","","API token for different app","",""
"","0","should return FALSE if two buffers are different","Helper functions","Fri Nov 14 22:38:31 UTC 2025","passed","Fri Nov 14 22:38:31 UTC 2025","","compareBuffers","",""
"","","can download files including special characters in subTable","getRecords","Fri Nov 14 22:38:28 UTC 2025","skipped","","","","",""
"","1","should throw error when API response is error","getRecords","Fri Nov 14 22:38:29 UTC 2025","passed","Fri Nov 14 22:38:29 UTC 2025","","","",""
"","2","should convert csv string to JSON correctly (CRLF)","parseCsv","Fri Nov 14 22:38:34 UTC 2025","passed","Fri Nov 14 22:38:34 UTC 2025","","","",""
"","704","Password is not specified","","Fri Nov 14 22:43:16 UTC 2025","passed","Fri Nov 14 22:43:17 UTC 2025","","Password is not specified","",""
"","1","can iterate from data source with next value","withNextIterator","Fri Nov 14 22:38:29 UTC 2025","passed","Fri Nov 14 22:38:29 UTC 2025","","","",""
