"DESCRIPTION","DURATION IN MS","NAME","PARENT SUITE","START TIME","STATUS","STOP TIME","SUB SUITE","SUITE","TEST CLASS","TEST METHOD"
"","1","toStringCause should output the correct sentence. (inner: KintoneAllRecordsError)","CliKintoneError","Thu Jan 09 18:20:56 GMT 2025","passed","Thu Jan 09 18:20:56 GMT 2025","","","",""
"","4493","Condition query - short option","","Thu Jan 09 18:23:16 GMT 2025","passed","Thu Jan 09 18:23:20 GMT 2025","","Condition query - short option","",""
"","1","[5] convert NUMBER field correctly","convertFieldValue","Thu Jan 09 18:20:56 GMT 2025","passed","Thu Jan 09 18:20:56 GMT 2025","","","",""
"","35","invalid `https-url`","validate","Thu Jan 09 18:21:02 GMT 2025","passed","Thu Jan 09 18:21:02 GMT 2025","","","",""
"","127","App is not specified","","Thu Jan 09 18:21:49 GMT 2025","passed","Thu Jan 09 18:21:50 GMT 2025","","App is not specified","",""
"","2","should pass parameters to the apiClient correctly","addRecords","Thu Jan 09 18:20:55 GMT 2025","passed","Thu Jan 09 18:20:55 GMT 2025","","","",""
"","1","can iterate from data source with next value","withNextIterator","Thu Jan 09 18:20:56 GMT 2025","passed","Thu Jan 09 18:20:56 GMT 2025","","","",""
"","2","should return error message","DeleteAllRecordsError","Thu Jan 09 18:20:57 GMT 2025","passed","Thu Jan 09 18:20:57 GMT 2025","","","",""
"","654","Valid and invalid API tokens","","Thu Jan 09 18:22:16 GMT 2025","passed","Thu Jan 09 18:22:16 GMT 2025","","Valid and invalid API tokens","",""
"","2","should throw error when API response is error","getRecords","Thu Jan 09 18:20:55 GMT 2025","passed","Thu Jan 09 18:20:55 GMT 2025","","","",""
"","2","should upsert records correctly with non-updatable fields","upsertRecords","Thu Jan 09 18:20:56 GMT 2025","passed","Thu Jan 09 18:20:56 GMT 2025","","","",""
"","29","invalid `fileExists`","validate","Thu Jan 09 18:21:02 GMT 2025","passed","Thu Jan 09 18:21:02 GMT 2025","","","",""
"","1","can iterate from data source with index","withIndexIterator","Thu Jan 09 18:20:56 GMT 2025","passed","Thu Jan 09 18:20:56 GMT 2025","","","",""
"","4657","Invalid API token and valid login information","","Thu Jan 09 18:21:55 GMT 2025","passed","Thu Jan 09 18:21:59 GMT 2025","","Invalid API token and valid login information","",""
"","1","userSelected should create schema correctly","createSchema","Thu Jan 09 18:21:02 GMT 2025","passed","Thu Jan 09 18:21:02 GMT 2025","","","",""
"","12804","Attachments on multiple fields","","Thu Jan 09 18:22:53 GMT 2025","passed","Thu Jan 09 18:23:06 GMT 2025","","Attachments on multiple fields","",""
"","1","should throw with invalid error (input: Hoge-123, appCode: )","hasAppCode","Thu Jan 09 18:21:01 GMT 2025","passed","Thu Jan 09 18:21:01 GMT 2025","","","",""
"","1","[6] convert LINK field correctly","convertFieldValue","Thu Jan 09 18:20:56 GMT 2025","passed","Thu Jan 09 18:20:56 GMT 2025","","","",""
"","5","should not fail","deleteAllRecords","Thu Jan 09 18:20:58 GMT 2025","passed","Thu Jan 09 18:20:58 GMT 2025","","","",""
"","2","should upsert records correctly with single line text","upsertRecords","Thu Jan 09 18:20:56 GMT 2025","passed","Thu Jan 09 18:20:56 GMT 2025","","","",""
"","4","should return a file list including the manifest","sourcelist","Thu Jan 09 18:20:57 GMT 2025","passed","Thu Jan 09 18:20:57 GMT 2025","","","",""
"","1","[2] convert RADIO_BUTTON field correctly","convertFieldValue","Thu Jan 09 18:20:56 GMT 2025","passed","Thu Jan 09 18:20:56 GMT 2025","","","",""
"","9074","Record has multiple attachments","","Thu Jan 09 18:22:50 GMT 2025","passed","Thu Jan 09 18:22:59 GMT 2025","","Record has multiple attachments","",""
"","671","API token is a draft","","Thu Jan 09 18:22:09 GMT 2025","passed","Thu Jan 09 18:22:09 GMT 2025","","API token is a draft","",""
"","688","A duplicate API token for the same app","","Thu Jan 09 18:22:04 GMT 2025","passed","Thu Jan 09 18:22:04 GMT 2025","","A duplicate API token for the same app","",""
"","1333","User does not have privilege to add records","","Thu Jan 09 18:21:52 GMT 2025","passed","Thu Jan 09 18:21:54 GMT 2025","","User does not have privilege to add records","",""
"","3458","Update-key field is not set to unique (number)","","Thu Jan 09 18:24:07 GMT 2025","passed","Thu Jan 09 18:24:10 GMT 2025","","Update-key field is not set to unique (number)","",""
"","1","[22] convert USER_SELECT field correctly","convertFieldValue","Thu Jan 09 18:20:56 GMT 2025","passed","Thu Jan 09 18:20:56 GMT 2025","","","",""
"","1","should replace placeholders correctly","Helper functions","Thu Jan 09 18:20:57 GMT 2025","passed","Thu Jan 09 18:20:57 GMT 2025","","replacePlaceholders","",""
"","3","throws error if format is JSON and encoding is not 'utf8'","readFile","Thu Jan 09 18:21:01 GMT 2025","passed","Thu Jan 09 18:21:01 GMT 2025","","","",""
"","121","File path is not specified","","Thu Jan 09 18:22:26 GMT 2025","passed","Thu Jan 09 18:22:27 GMT 2025","","File path is not specified","",""
"","4026","Specify a table","","Thu Jan 09 18:24:32 GMT 2025","passed","Thu Jan 09 18:24:36 GMT 2025","","Specify a table","",""
"","6","should convert kintone records to csv string correctly","csvStringifier","Thu Jan 09 18:20:58 GMT 2025","passed","Thu Jan 09 18:20:58 GMT 2025","","","",""
"","0","should be constructed with CsvError","ParserError","Thu Jan 09 18:21:02 GMT 2025","passed","Thu Jan 09 18:21:02 GMT 2025","","","",""
"","1","should throw an Error if specified field is not supported","userSelected","Thu Jan 09 18:20:57 GMT 2025","passed","Thu Jan 09 18:20:57 GMT 2025","","","",""
"","134","Unsupported encoding","","Thu Jan 09 18:24:00 GMT 2025","passed","Thu Jan 09 18:24:00 GMT 2025","","Unsupported encoding","",""
"","692","Incorrect password","","Thu Jan 09 18:21:54 GMT 2025","passed","Thu Jan 09 18:21:54 GMT 2025","","Incorrect password","",""
"","1","should display DEBUG message when calling logger with ""debug"" level","StandardLogger","Thu Jan 09 18:20:56 GMT 2025","passed","Thu Jan 09 18:20:56 GMT 2025","","","",""
"","4507","Specify multiple fields","","Thu Jan 09 18:23:35 GMT 2025","passed","Thu Jan 09 18:23:39 GMT 2025","","Specify multiple fields","",""
"","1","[16] convert MULTI_SELECT field correctly","convertFieldValue","Thu Jan 09 18:20:56 GMT 2025","passed","Thu Jan 09 18:20:56 GMT 2025","","","",""
"","3458","Specified update-key field is not supported","","Thu Jan 09 18:24:10 GMT 2025","passed","Thu Jan 09 18:24:14 GMT 2025","","Specified update-key field is not supported","",""
"","728","Specified attachment file does not exist","","Thu Jan 09 18:22:31 GMT 2025","passed","Thu Jan 09 18:22:32 GMT 2025","","Specified attachment file does not exist","",""
"","5328","App in a space","","Thu Jan 09 18:21:52 GMT 2025","passed","Thu Jan 09 18:21:57 GMT 2025","","App in a space","",""
"","1","number","hex2a","Thu Jan 09 18:21:02 GMT 2025","passed","Thu Jan 09 18:21:02 GMT 2025","","","",""
"","1","[8] convert CALC field correctly","convertFieldValue","Thu Jan 09 18:20:56 GMT 2025","passed","Thu Jan 09 18:20:56 GMT 2025","","","",""
"","6","should throw with invalid error (input: App-123, appCode: )","hasAppCode","Thu Jan 09 18:21:01 GMT 2025","passed","Thu Jan 09 18:21:01 GMT 2025","","","",""
"","3","should throw error when attachmentsDir is NOT given","addRecords","Thu Jan 09 18:20:55 GMT 2025","passed","Thu Jan 09 18:20:55 GMT 2025","","","",""
"","1","should convert kintone records to csv string correctly when FILE included and without attachmentsDir option","csvStringifier","Thu Jan 09 18:20:58 GMT 2025","passed","Thu Jan 09 18:20:58 GMT 2025","","","",""
"","1","should generate fieldCode array correctly (data with subtable)","buildHeaderFields","Thu Jan 09 18:20:58 GMT 2025","passed","Thu Jan 09 18:20:58 GMT 2025","","","",""
"","10651","Specify record number with customized field code","","Thu Jan 09 18:22:27 GMT 2025","passed","Thu Jan 09 18:22:38 GMT 2025","","Specify record number with customized field code","",""
"","1","[23] convert USER_SELECT field correctly","convertFieldValue","Thu Jan 09 18:20:56 GMT 2025","passed","Thu Jan 09 18:20:56 GMT 2025","","","",""
