"DESCRIPTION","DURATION IN MS","NAME","PARENT SUITE","START TIME","STATUS","STOP TIME","SUB SUITE","SUITE","TEST CLASS","TEST METHOD"
"","306","should throw error when no commands are passed","main","Fri Mar 06 16:39:22 UTC 2026","passed","Fri Mar 06 16:39:22 UTC 2026","","","",""
"","3","存在しないファイルパスでエラーをスローする","template/manifest","Fri Mar 06 16:39:18 UTC 2026","passed","Fri Mar 06 16:39:18 UTC 2026","","updateManifests","",""
"","1129","App does not exist","","Fri Mar 06 16:40:12 UTC 2026","passed","Fri Mar 06 16:40:13 UTC 2026","","App does not exist","",""
"","552","Invalid URL format","","Fri Mar 06 16:40:12 UTC 2026","passed","Fri Mar 06 16:40:12 UTC 2026","","Invalid URL format","",""
"","3808","Upload plugin.zip","","Fri Mar 06 16:40:11 UTC 2026","passed","Fri Mar 06 16:40:15 UTC 2026","","Upload plugin.zip","",""
"","1","[$#] convert 'RICH_TEXT' field correctly","convertFieldValue","Fri Mar 06 16:39:18 UTC 2026","passed","Fri Mar 06 16:39:18 UTC 2026","","","",""
"","298","should reject when no auth is provided","record export","Fri Mar 06 16:39:19 UTC 2026","passed","Fri Mar 06 16:39:19 UTC 2026","","","",""
"","1","should display DEBUG message when calling logger with ""debug"" level","StandardLogger","Fri Mar 06 16:39:19 UTC 2026","passed","Fri Mar 06 16:39:19 UTC 2026","","","",""
"","1","should throw an Error if specified field is in a Table field","userSelected","Fri Mar 06 16:39:21 UTC 2026","passed","Fri Mar 06 16:39:21 UTC 2026","","","",""
"","1","should return error message","AddRecordsError","Fri Mar 06 16:39:19 UTC 2026","passed","Fri Mar 06 16:39:19 UTC 2026","","","",""
"","5123","API tokens for different apps","","Fri Mar 06 16:40:36 UTC 2026","passed","Fri Mar 06 16:40:41 UTC 2026","","API tokens for different apps","",""
"","1987","Specify with incorrect app code","","Fri Mar 06 16:40:37 UTC 2026","passed","Fri Mar 06 16:40:39 UTC 2026","","Specify with incorrect app code","",""
"","767","API token is a draft","","Fri Mar 06 16:40:28 UTC 2026","passed","Fri Mar 06 16:40:29 UTC 2026","","API token is a draft","",""
"","1","[$#] convert 'SUBTABLE' field correctly","convertFieldValue","Fri Mar 06 16:39:18 UTC 2026","passed","Fri Mar 06 16:39:18 UTC 2026","","","",""
"","714","Valid and invalid API tokens","","Fri Mar 06 16:40:22 UTC 2026","passed","Fri Mar 06 16:40:23 UTC 2026","","Valid and invalid API tokens","",""
"","1","should return the export query correctly","Record command","Fri Mar 06 16:39:21 UTC 2026","passed","Fri Mar 06 16:39:21 UTC 2026","","Valid parameters","",""
"","3241","Specified record does not exist","","Fri Mar 06 16:40:46 UTC 2026","passed","Fri Mar 06 16:40:49 UTC 2026","","Specified record does not exist","",""
"","1","should throw an error when all retries are failed","retry","Fri Mar 06 16:39:18 UTC 2026","passed","Fri Mar 06 16:39:18 UTC 2026","","input sync function","",""
"","873","API token is a draft","","Fri Mar 06 16:40:13 UTC 2026","passed","Fri Mar 06 16:40:14 UTC 2026","","API token is a draft","",""
"","353","Cancel the operation at confirmation","","Fri Mar 06 16:40:10 UTC 2026","passed","Fri Mar 06 16:40:10 UTC 2026","","Cancel the operation at confirmation","",""
"","1","'should throw error when the record nu…'","validateRecordNumbers","Fri Mar 06 16:39:22 UTC 2026","passed","Fri Mar 06 16:39:22 UTC 2026","","","",""
"","1","should throw an error when all retries are failed","retry","Fri Mar 06 16:39:18 UTC 2026","passed","Fri Mar 06 16:39:18 UTC 2026","","input async function","",""
"","7","can download files to a specified directory","getRecords","Fri Mar 06 16:39:18 UTC 2026","passed","Fri Mar 06 16:39:18 UTC 2026","","","",""
"","4631","API token does not have privilege to edit records","","Fri Mar 06 16:41:15 UTC 2026","passed","Fri Mar 06 16:41:20 UTC 2026","","API token does not have privilege to edit records","",""
"","3","should show warning message if there is no records exist in the app or match the condition.","getRecords","Fri Mar 06 16:39:18 UTC 2026","passed","Fri Mar 06 16:39:18 UTC 2026","","","",""
"","1","can separate date source by group and chunked","groupByKeyChunked","Fri Mar 06 16:39:18 UTC 2026","passed","Fri Mar 06 16:39:18 UTC 2026","","","",""
"","18","'`fileExists`'","validate","Fri Mar 06 16:39:22 UTC 2026","passed","Fri Mar 06 16:39:22 UTC 2026","","","",""
"","1","[$#] convert 'UPDATED_TIME' field correctly","convertFieldValue","Fri Mar 06 16:39:18 UTC 2026","passed","Fri Mar 06 16:39:18 UTC 2026","","","",""
"","1","should throw error when file path is invalid","File Generator functions","Fri Mar 06 16:39:23 UTC 2026","passed","Fri Mar 06 16:39:23 UTC 2026","","","",""
"","1","should return FALSE if two buffers are different","Helper functions","Fri Mar 06 16:39:21 UTC 2026","passed","Fri Mar 06 16:39:21 UTC 2026","","compareBuffers","",""
"","3","存在するテンプレート名でtrueを返す","template/github","Fri Mar 06 16:39:18 UTC 2026","passed","Fri Mar 06 16:39:18 UTC 2026","","isGitHubTemplateExists","",""
"","4682","Specify multiple fields","","Fri Mar 06 16:41:18 UTC 2026","passed","Fri Mar 06 16:41:23 UTC 2026","","Specify multiple fields","",""
"","3","package.jsonのnameフィールドを更新する","template/package-json","Fri Mar 06 16:39:19 UTC 2026","passed","Fri Mar 06 16:39:19 UTC 2026","","updatePackageJson","",""
"","5968","Proceed with the execution by pressing ""Y""","","Fri Mar 06 16:41:02 UTC 2026","passed","Fri Mar 06 16:41:08 UTC 2026","","Proceed with the execution by pressing ""Y""","",""
"","1","should return error message","AddRecordsError","Fri Mar 06 16:39:22 UTC 2026","passed","Fri Mar 06 16:39:22 UTC 2026","","","",""
"","1","should return the arguments list of the record 'export' correctly","Record - Subcommand","Fri Mar 06 16:39:22 UTC 2026","passed","Fri Mar 06 16:39:22 UTC 2026","","getArgumentsListBySubcommand","",""
"","985","Specified app does not exist","","Fri Mar 06 16:40:10 UTC 2026","passed","Fri Mar 06 16:40:11 UTC 2026","","Specified app does not exist","",""
"","1","should return error message","UpsertRecordsError","Fri Mar 06 16:39:22 UTC 2026","passed","Fri Mar 06 16:39:22 UTC 2026","","","",""
"","5065","Exported data is in CSV format","","Fri Mar 06 16:40:25 UTC 2026","passed","Fri Mar 06 16:40:30 UTC 2026","","Exported data is in CSV format","",""
"","1","[$#] convert 'RADIO_BUTTON' field correctly","convertFieldValue","Fri Mar 06 16:39:18 UTC 2026","passed","Fri Mar 06 16:39:18 UTC 2026","","","",""
"","2","should not fail","deleteAllRecords","Fri Mar 06 16:39:22 UTC 2026","passed","Fri Mar 06 16:39:22 UTC 2026","","","",""
"","124","the zip contains 3 files","PluginZip","Fri Mar 06 16:39:23 UTC 2026","passed","Fri Mar 06 16:39:24 UTC 2026","","","",""
"","1","should be set zh parameters in supportZh is true","qa","Fri Mar 06 16:39:19 UTC 2026","passed","Fri Mar 06 16:39:19 UTC 2026","optional lang parameters","runPrompt","",""
"","1","should generate CSV row correctly","Helper functions","Fri Mar 06 16:39:21 UTC 2026","passed","Fri Mar 06 16:39:21 UTC 2026","","generateCsvRow","",""
"","3454","API token does not have privilege to view and edit records","","Fri Mar 06 16:40:41 UTC 2026","passed","Fri Mar 06 16:40:45 UTC 2026","","API token does not have privilege to view and edit records","",""
"","1","toStringCause should output the correct sentence. (inner: KintoneRestAPIError)","CliKintoneError","Fri Mar 06 16:39:18 UTC 2026","passed","Fri Mar 06 16:39:18 UTC 2026","","","",""
"","1","[$#] convert 'STATUS_ASSIGNEE' field correctly","convertFieldValue","Fri Mar 06 16:39:18 UTC 2026","passed","Fri Mar 06 16:39:18 UTC 2026","","","",""
"","504","Get version","","Fri Mar 06 16:40:11 UTC 2026","passed","Fri Mar 06 16:40:12 UTC 2026","","Get version","",""
"","901","Specified attachment directory does not exist","","Fri Mar 06 16:40:31 UTC 2026","passed","Fri Mar 06 16:40:32 UTC 2026","","Specified attachment directory does not exist","",""
"","1","[$#] convert 'CREATOR' field correctly","convertFieldValue","Fri Mar 06 16:39:18 UTC 2026","passed","Fri Mar 06 16:39:18 UTC 2026","","","",""
"","522","No app option","","Fri Mar 06 16:40:12 UTC 2026","passed","Fri Mar 06 16:40:12 UTC 2026","","No app option","",""
"","1510","Unsupported encoding","","Fri Mar 06 16:41:23 UTC 2026","passed","Fri Mar 06 16:41:24 UTC 2026","","Unsupported encoding","",""
"","510","App is not specified","","Fri Mar 06 16:40:12 UTC 2026","passed","Fri Mar 06 16:40:12 UTC 2026","","App is not specified","",""
"","1","should be able to validate by validateForDescription","qa","Fri Mar 06 16:39:19 UTC 2026","passed","Fri Mar 06 16:39:19 UTC 2026","","validator","",""
"","1","[$#] convert 'DATETIME' field correctly","convertFieldValue","Fri Mar 06 16:39:18 UTC 2026","passed","Fri Mar 06 16:39:18 UTC 2026","","","",""
"","1","[$#] convert 'SUBTABLE' field correctly","convertFieldValue","Fri Mar 06 16:39:18 UTC 2026","passed","Fri Mar 06 16:39:18 UTC 2026","","","",""
"","2","should pass username and password to the apiClient correctly","api","Fri Mar 06 16:39:18 UTC 2026","passed","Fri Mar 06 16:39:18 UTC 2026","","","",""
"","298","should reject when no auth is provided","record delete","Fri Mar 06 16:39:19 UTC 2026","passed","Fri Mar 06 16:39:20 UTC 2026","","","",""
"","1","should set ""info"" to the log config level when log-level argument is ""info""","logHandler","Fri Mar 06 16:39:24 UTC 2026","passed","Fri Mar 06 16:39:24 UTC 2026","","","",""
"","2","should includes a Record Number field","addRecords","Fri Mar 06 16:39:18 UTC 2026","passed","Fri Mar 06 16:39:18 UTC 2026","","","",""
"","1","should be constructed with CsvError","ParserError","Fri Mar 06 16:39:24 UTC 2026","passed","Fri Mar 06 16:39:24 UTC 2026","","","",""
"","301","should throw error when an undefined command is passed","main","Fri Mar 06 16:39:22 UTC 2026","passed","Fri Mar 06 16:39:23 UTC 2026","","","",""
"","4054","Cancel the operation at confirmation","","Fri Mar 06 16:40:23 UTC 2026","passed","Fri Mar 06 16:40:27 UTC 2026","","Cancel the operation at confirmation","",""
"","1","should return true if the string is URL","util","Fri Mar 06 16:39:24 UTC 2026","passed","Fri Mar 06 16:39:24 UTC 2026","","isUrlString","",""
"","1","[$#] convert 'GROUP_SELECT' field correctly","convertFieldValue","Fri Mar 06 16:39:18 UTC 2026","passed","Fri Mar 06 16:39:18 UTC 2026","","","",""
"","21","'`https-url`'","validate","Fri Mar 06 16:39:22 UTC 2026","passed","Fri Mar 06 16:39:22 UTC 2026","","","",""
"","1","toStringCause should output the correct sentence. (inner: KintoneAllRecordsError)","CliKintoneError","Fri Mar 06 16:39:18 UTC 2026","passed","Fri Mar 06 16:39:18 UTC 2026","","","",""
"","1","throws error if format is JSON and encoding is not 'utf8'","readFile","Fri Mar 06 16:39:24 UTC 2026","passed","Fri Mar 06 16:39:24 UTC 2026","","","",""
"","1","should throw an error when retry conditions are not match","retry","Fri Mar 06 16:39:18 UTC 2026","passed","Fri Mar 06 16:39:18 UTC 2026","","input sync function","",""
"","5209","App in a space","","Fri Mar 06 16:40:19 UTC 2026","passed","Fri Mar 06 16:40:24 UTC 2026","","App in a space","",""
"","1","[$#] convert 'LINK' field correctly","convertFieldValue","Fri Mar 06 16:39:18 UTC 2026","passed","Fri Mar 06 16:39:18 UTC 2026","","","",""
"","344","Specify output path","","Fri Mar 06 16:40:10 UTC 2026","passed","Fri Mar 06 16:40:10 UTC 2026","","Specify output path","",""
"","1","[$#] convert 'MODIFIER' field correctly","convertFieldValue","Fri Mar 06 16:39:18 UTC 2026","passed","Fri Mar 06 16:39:18 UTC 2026","","","",""
"","2153","Specify a field in a table","","Fri Mar 06 16:40:33 UTC 2026","passed","Fri Mar 06 16:40:35 UTC 2026","","Specify a field in a table","",""
"","834","A duplicate API token for the same app","","Fri Mar 06 16:40:13 UTC 2026","passed","Fri Mar 06 16:40:14 UTC 2026","","A duplicate API token for the same app","",""
"","1","[$#] convert 'CATEGORY' field correctly","convertFieldValue","Fri Mar 06 16:39:18 UTC 2026","passed","Fri Mar 06 16:39:18 UTC 2026","","","",""
"","2","should not fail","deleteRecords","Fri Mar 06 16:39:22 UTC 2026","passed","Fri Mar 06 16:39:22 UTC 2026","","","",""
"","1","can separate data source by chunk","chunked","Fri Mar 06 16:39:18 UTC 2026","passed","Fri Mar 06 16:39:18 UTC 2026","","","",""
"","1","should return a file list including the manifest","sourcelist","Fri Mar 06 16:39:21 UTC 2026","passed","Fri Mar 06 16:39:21 UTC 2026","","","",""
"","5","can read sjis encoded csv file correctly","readFile","Fri Mar 06 16:39:24 UTC 2026","passed","Fri Mar 06 16:39:24 UTC 2026","","","",""
"","6043","Unsupported character for confirmation message","","Fri Mar 06 16:41:08 UTC 2026","passed","Fri Mar 06 16:41:14 UTC 2026","","Unsupported character for confirmation message","",""
"","1","[$#] convert 'CALC' field correctly","convertFieldValue","Fri Mar 06 16:39:18 UTC 2026","passed","Fri Mar 06 16:39:18 UTC 2026","","","",""
"","2","can get records","getRecords","Fri Mar 06 16:39:18 UTC 2026","passed","Fri Mar 06 16:39:18 UTC 2026","","","",""
"","2","不正なJSONファイルでエラーをスローする","template/manifest","Fri Mar 06 16:39:18 UTC 2026","passed","Fri Mar 06 16:39:18 UTC 2026","","updateManifests","",""
"","1","should display ERROR message when calling logger with ""error"" level","StandardLogger","Fri Mar 06 16:39:19 UTC 2026","passed","Fri Mar 06 16:39:19 UTC 2026","","","",""
"","5315","Valid ordering","","Fri Mar 06 16:41:04 UTC 2026","passed","Fri Mar 06 16:41:09 UTC 2026","","Valid ordering","",""
"","1","should be able to validate by validateForName","qa","Fri Mar 06 16:39:19 UTC 2026","passed","Fri Mar 06 16:39:19 UTC 2026","","validator","",""
"","1","should throw an error when retry conditions are not match","retry","Fri Mar 06 16:39:18 UTC 2026","passed","Fri Mar 06 16:39:18 UTC 2026","","input async function","",""
"","2","should generate file correctly","File Generator functions","Fri Mar 06 16:39:23 UTC 2026","passed","Fri Mar 06 16:39:23 UTC 2026","","Generate file success","",""
"","1","'should convert csv string to JSON cor…'","parseCsv","Fri Mar 06 16:39:23 UTC 2026","passed","Fri Mar 06 16:39:23 UTC 2026","","","",""
"","10876","Multiple attachments on a field","","Fri Mar 06 16:40:41 UTC 2026","passed","Fri Mar 06 16:40:52 UTC 2026","","Multiple attachments on a field","",""
"","1","should set ""debug"" to the log config level when verbose argument is true","logHandler","Fri Mar 06 16:39:24 UTC 2026","passed","Fri Mar 06 16:39:24 UTC 2026","","","",""
"","1","[$#] convert 'ORGANIZATION_SELECT' field correctly","convertFieldValue","Fri Mar 06 16:39:18 UTC 2026","passed","Fri Mar 06 16:39:18 UTC 2026","","","",""
"","3537","Specify attachments directory nevertheless app does not have an attachment field","","Fri Mar 06 16:40:59 UTC 2026","passed","Fri Mar 06 16:41:03 UTC 2026","","Specify attachments directory nevertheless app does not have an attachment field","",""
"","301","should reject when no auth is provided","plugin upload","Fri Mar 06 16:39:20 UTC 2026","passed","Fri Mar 06 16:39:20 UTC 2026","","","",""
"","2","should success generating customize-manifest.json","init","Fri Mar 06 16:39:24 UTC 2026","passed","Fri Mar 06 16:39:24 UTC 2026","","runInit","",""
"","8041","Record has a .txt file attachment","","Fri Mar 06 16:40:57 UTC 2026","passed","Fri Mar 06 16:41:05 UTC 2026","","Record has a .txt file attachment","",""
"","983","Packages a plugin to a custom output path","","Fri Mar 06 16:40:11 UTC 2026","passed","Fri Mar 06 16:40:12 UTC 2026","","Packages a plugin to a custom output path","",""
"","1","[$#] convert 'CREATOR' field correctly","convertFieldValue","Fri Mar 06 16:39:18 UTC 2026","passed","Fri Mar 06 16:39:18 UTC 2026","","","",""
"","1","[$#] convert 'RECORD_NUMBER' field correctly","convertFieldValue","Fri Mar 06 16:39:18 UTC 2026","passed","Fri Mar 06 16:39:18 UTC 2026","","","",""
"","9081","Record has multiple attachments","","Fri Mar 06 16:40:48 UTC 2026","passed","Fri Mar 06 16:40:57 UTC 2026","","Record has multiple attachments","",""
"","4588","Specify multiple fields","","Fri Mar 06 16:41:07 UTC 2026","passed","Fri Mar 06 16:41:12 UTC 2026","","Specify multiple fields","",""
"","1","should pass guestSpaceId to the apiClient correctly","api","Fri Mar 06 16:39:18 UTC 2026","passed","Fri Mar 06 16:39:18 UTC 2026","","","",""
"","2","'should upsert records correctly with …'","upsertRecords","Fri Mar 06 16:39:18 UTC 2026","passed","Fri Mar 06 16:39:18 UTC 2026","","","",""
"","11674","Utf8 encoded file","","Fri Mar 06 16:40:15 UTC 2026","passed","Fri Mar 06 16:40:27 UTC 2026","","Utf8 encoded file","",""
"","765","Valid and invalid API tokens","","Fri Mar 06 16:40:29 UTC 2026","passed","Fri Mar 06 16:40:30 UTC 2026","","Valid and invalid API tokens","",""
"","1","[$#] convert 'CHECK_BOX' field correctly","convertFieldValue","Fri Mar 06 16:39:18 UTC 2026","passed","Fri Mar 06 16:39:18 UTC 2026","","","",""
"","1","'should convert empty array to csv str…'","csvStringifier","Fri Mar 06 16:39:22 UTC 2026","passed","Fri Mar 06 16:39:22 UTC 2026","","","",""
"","837","Valid and invalid API tokens","","Fri Mar 06 16:40:13 UTC 2026","passed","Fri Mar 06 16:40:14 UTC 2026","","Valid and invalid API tokens","",""
"","3","'should convert multiple subtables inc…'","parseCsv","Fri Mar 06 16:39:23 UTC 2026","passed","Fri Mar 06 16:39:23 UTC 2026","","","",""
"","1","[$#] convert 'CREATED_TIME' field correctly","convertFieldValue","Fri Mar 06 16:39:18 UTC 2026","passed","Fri Mar 06 16:39:18 UTC 2026","","","",""
"","1","should be set ja parameters in supportJa is true","qa","Fri Mar 06 16:39:19 UTC 2026","passed","Fri Mar 06 16:39:19 UTC 2026","optional lang parameters","runPrompt","",""
"","6021","App in a guest space","","Fri Mar 06 16:40:09 UTC 2026","passed","Fri Mar 06 16:40:15 UTC 2026","","App in a guest space","",""
"","10713","Upsert by record number","","Fri Mar 06 16:40:33 UTC 2026","passed","Fri Mar 06 16:40:43 UTC 2026","","Upsert by record number","",""
"","1","should not display any message when calling logger with 'none' level","StandardLogger","Fri Mar 06 16:39:19 UTC 2026","passed","Fri Mar 06 16:39:19 UTC 2026","","","",""
"","1","'userSelected should create schema cor…'","createSchema","Fri Mar 06 16:39:24 UTC 2026","passed","Fri Mar 06 16:39:24 UTC 2026","","","",""
"","3","should reject when only password is provided","buildConnectionOptions with password auth","Fri Mar 06 16:39:21 UTC 2026","passed","Fri Mar 06 16:39:21 UTC 2026","","","",""
"","4907","Login authorization - short username option","","Fri Mar 06 16:40:40 UTC 2026","passed","Fri Mar 06 16:40:45 UTC 2026","","Login authorization - short username option","",""
"","1","[$#] convert 'MULTI_LINE_TEXT' field correctly","convertFieldValue","Fri Mar 06 16:39:18 UTC 2026","passed","Fri Mar 06 16:39:18 UTC 2026","","","",""
"","1","should emit experimental warning message","stability","Fri Mar 06 16:39:22 UTC 2026","passed","Fri Mar 06 16:39:22 UTC 2026","","emitExperimentalWarning","",""
"","297","should reject --api-token with auth required error","plugin upload","Fri Mar 06 16:39:20 UTC 2026","passed","Fri Mar 06 16:39:21 UTC 2026","","","",""
"","4675","Condition query - short option","","Fri Mar 06 16:40:59 UTC 2026","passed","Fri Mar 06 16:41:04 UTC 2026","","Condition query - short option","",""
"","3","should accept when username and password are provided","buildConnectionOptions with either auth","Fri Mar 06 16:39:21 UTC 2026","passed","Fri Mar 06 16:39:21 UTC 2026","","","",""
"","1","should return the delete query correctly","Record command","Fri Mar 06 16:39:21 UTC 2026","passed","Fri Mar 06 16:39:21 UTC 2026","","Valid parameters","",""
"","1","should return error message","DeleteAllRecordsError","Fri Mar 06 16:39:22 UTC 2026","passed","Fri Mar 06 16:39:22 UTC 2026","","","",""
"","4717","Invalid ordering with a non-existent field","","Fri Mar 06 16:41:09 UTC 2026","passed","Fri Mar 06 16:41:14 UTC 2026","","Invalid ordering with a non-existent field","",""
"","1","[$#] convert 'TIME' field correctly","convertFieldValue","Fri Mar 06 16:39:18 UTC 2026","passed","Fri Mar 06 16:39:18 UTC 2026","","","",""
"","1","[$#] convert 'MULTI_SELECT' field correctly","convertFieldValue","Fri Mar 06 16:39:18 UTC 2026","passed","Fri Mar 06 16:39:18 UTC 2026","","","",""
"","1","'formLayout should create schema corre…'","createSchema","Fri Mar 06 16:39:24 UTC 2026","passed","Fri Mar 06 16:39:24 UTC 2026","","","",""
"","3","should reject when no auth is provided","buildConnectionOptions with apiToken auth","Fri Mar 06 16:39:21 UTC 2026","passed","Fri Mar 06 16:39:21 UTC 2026","","","",""
"","13447","Attachments on multiple records","","Fri Mar 06 16:41:05 UTC 2026","passed","Fri Mar 06 16:41:19 UTC 2026","","Attachments on multiple records","",""
"","5","JavaScriptテンプレートで完全なセットアップが完了する","template","Fri Mar 06 16:39:18 UTC 2026","passed","Fri Mar 06 16:39:18 UTC 2026","","setupTemplate","",""
"","1611","User does not have privilege to add records","","Fri Mar 06 16:40:27 UTC 2026","passed","Fri Mar 06 16:40:28 UTC 2026","","User does not have privilege to add records","",""
"","4818","Login authorization - short password option","","Fri Mar 06 16:40:45 UTC 2026","passed","Fri Mar 06 16:40:50 UTC 2026","","Login authorization - short password option","",""
"","10634","Upsert by text field","","Fri Mar 06 16:40:43 UTC 2026","passed","Fri Mar 06 16:40:54 UTC 2026","","Upsert by text field","",""
"","4770","App in a guest space (record import)","","Fri Mar 06 16:40:39 UTC 2026","passed","Fri Mar 06 16:40:44 UTC 2026","","App in a guest space (record import)","",""
"","1","should display the correct log message with multiple lines message","StandardLogger","Fri Mar 06 16:39:19 UTC 2026","passed","Fri Mar 06 16:39:19 UTC 2026","","","",""
"","1","should pass information of client certificate to the apiClient correctly","api","Fri Mar 06 16:39:18 UTC 2026","passed","Fri Mar 06 16:39:18 UTC 2026","","","",""
"","3","should reject when no auth is provided","buildConnectionOptions with either auth","Fri Mar 06 16:39:21 UTC 2026","passed","Fri Mar 06 16:39:21 UTC 2026","","","",""
"","39","manifest v1","ContentsZip","Fri Mar 06 16:39:21 UTC 2026","passed","Fri Mar 06 16:39:21 UTC 2026","","should be able to create ContentsZip from a plugin directory","",""
"","903","Record number is not specified in a file","","Fri Mar 06 16:40:17 UTC 2026","passed","Fri Mar 06 16:40:18 UTC 2026","","Record number is not specified in a file","",""
"","1","should set ""warn"" to the log config level when log-level argument is ""warn""","logHandler","Fri Mar 06 16:39:24 UTC 2026","passed","Fri Mar 06 16:39:24 UTC 2026","","","",""
"","1","should replace placeholders correctly","Helper functions","Fri Mar 06 16:39:21 UTC 2026","passed","Fri Mar 06 16:39:21 UTC 2026","","replacePlaceholders","",""
"","1","should set ""trace"" to the log config level when log-level argument is ""trace""","logHandler","Fri Mar 06 16:39:24 UTC 2026","passed","Fri Mar 06 16:39:24 UTC 2026","","","",""
"","1","[$#] convert 'ORGANIZATION_SELECT' field correctly","convertFieldValue","Fri Mar 06 16:39:18 UTC 2026","passed","Fri Mar 06 16:39:18 UTC 2026","","","",""
"","6219","Cancel the execution by pressing ""N""","","Fri Mar 06 16:40:56 UTC 2026","passed","Fri Mar 06 16:41:02 UTC 2026","","Cancel the execution by pressing ""N""","",""
"","1","[$#] convert 'SINGLE_LINE_TEXT' field correctly","convertFieldValue","Fri Mar 06 16:39:18 UTC 2026","passed","Fri Mar 06 16:39:18 UTC 2026","","","",""
"","1","should show progress logs correctly with aborting","ProgressLogger","Fri Mar 06 16:39:22 UTC 2026","passed","Fri Mar 06 16:39:22 UTC 2026","","","",""
"","1","should be constructed with CsvError","ParserError","Fri Mar 06 16:39:24 UTC 2026","passed","Fri Mar 06 16:39:24 UTC 2026","","","",""
"","2","should throw error when API response is error","deleteAllRecords","Fri Mar 06 16:39:22 UTC 2026","passed","Fri Mar 06 16:39:22 UTC 2026","","","",""
"","21","'`maxFileSize`'","validate","Fri Mar 06 16:39:22 UTC 2026","passed","Fri Mar 06 16:39:22 UTC 2026","","","",""
"","2","'should throw error because the record…'","upsertRecords","Fri Mar 06 16:39:18 UTC 2026","passed","Fri Mar 06 16:39:18 UTC 2026","","","",""
"","1","should return error message","DeleteAllRecordsError","Fri Mar 06 16:39:24 UTC 2026","passed","Fri Mar 06 16:39:24 UTC 2026","","","",""
"","1","存在するJavaScriptテンプレート名から正しいTemplateSourceを生成する","template/github","Fri Mar 06 16:39:19 UTC 2026","passed","Fri Mar 06 16:39:19 UTC 2026","","resolveGitHubTemplateSource","",""
"","7","manifest v2","ContentsZip","Fri Mar 06 16:39:21 UTC 2026","passed","Fri Mar 06 16:39:21 UTC 2026","","should be able to create ContentsZip from a plugin directory","",""
"","751","Incorrect password","","Fri Mar 06 16:40:13 UTC 2026","passed","Fri Mar 06 16:40:13 UTC 2026","","Incorrect password","",""
"","4836","Record data with table fields","","Fri Mar 06 16:40:40 UTC 2026","passed","Fri Mar 06 16:40:45 UTC 2026","","Record data with table fields","",""
"","1","should be set es parameters in supportEs is true","qa","Fri Mar 06 16:39:19 UTC 2026","passed","Fri Mar 06 16:39:19 UTC 2026","optional lang parameters","runPrompt","",""
"","1","should throw an Error if specified field is not supported","userSelected","Fri Mar 06 16:39:21 UTC 2026","passed","Fri Mar 06 16:39:21 UTC 2026","","","",""
"","1","[$#] convert 'TIME' field correctly","convertFieldValue","Fri Mar 06 16:39:18 UTC 2026","passed","Fri Mar 06 16:39:18 UTC 2026","","","",""
"","1","should throw error when missing required argument","Record command","Fri Mar 06 16:39:21 UTC 2026","passed","Fri Mar 06 16:39:21 UTC 2026","","Missing required parameters","",""
