"DESCRIPTION","DURATION IN MS","NAME","PARENT SUITE","START TIME","STATUS","STOP TIME","SUB SUITE","SUITE","TEST CLASS","TEST METHOD"
"","1","should pass information of client certificate and proxy server to the apiClient correctly","api","Sat Feb 01 22:17:01 GMT 2025","passed","Sat Feb 01 22:17:01 GMT 2025","","","",""
"","0","[13] convert FILE field correctly","convertFieldValue","Sat Feb 01 22:17:02 GMT 2025","passed","Sat Feb 01 22:17:02 GMT 2025","","","",""
"","1","should throw error when non-existent field is passed as update key","upsertRecords","Sat Feb 01 22:17:02 GMT 2025","passed","Sat Feb 01 22:17:02 GMT 2025","","","",""
"","2","toStringCause should output the correct sentence. (inner: CliKintoneError)","CliKintoneError","Sat Feb 01 22:17:02 GMT 2025","passed","Sat Feb 01 22:17:02 GMT 2025","","","",""
"","1","should generate fieldCode array correctly (data with subtable)","buildHeaderFields","Sat Feb 01 22:17:04 GMT 2025","passed","Sat Feb 01 22:17:04 GMT 2025","","","",""
"","1","should make the file list unique","sourcelist","Sat Feb 01 22:17:03 GMT 2025","passed","Sat Feb 01 22:17:03 GMT 2025","","","",""
"","2560","Update-key field is not set to unique (number)","","Sat Feb 01 22:19:43 GMT 2025","passed","Sat Feb 01 22:19:45 GMT 2025","","Update-key field is not set to unique (number)","",""
"","4","[20] convert FILE field correctly","convertFieldValue","Sat Feb 01 22:17:02 GMT 2025","passed","Sat Feb 01 22:17:02 GMT 2025","","","",""
"","","can download files including special characters","getRecords","Sat Feb 01 22:17:01 GMT 2025","skipped","","","","",""
"","0","[25] convert ORGANIZATION_SELECT field correctly","convertFieldValue","Sat Feb 01 22:17:02 GMT 2025","passed","Sat Feb 01 22:17:02 GMT 2025","","","",""
"","2465","API token does not have privilege to view and edit records","","Sat Feb 01 22:18:17 GMT 2025","passed","Sat Feb 01 22:18:20 GMT 2025","","API token does not have privilege to view and edit records","",""
"","506","API token is a draft","","Sat Feb 01 22:18:11 GMT 2025","passed","Sat Feb 01 22:18:12 GMT 2025","","API token is a draft","",""
"","1","[15] convert DATE field correctly","convertFieldValue","Sat Feb 01 22:17:02 GMT 2025","passed","Sat Feb 01 22:17:02 GMT 2025","","","",""
"","0","[26] convert GROUP_SELECT field correctly","convertFieldValue","Sat Feb 01 22:17:02 GMT 2025","passed","Sat Feb 01 22:17:02 GMT 2025","","","",""
"","7894","Specify record number with customized field code","","Sat Feb 01 22:18:30 GMT 2025","passed","Sat Feb 01 22:18:37 GMT 2025","","Specify record number with customized field code","",""
"","1","should return the arguments list of the record delete correctly","Record - Subcommand","Sat Feb 01 22:17:04 GMT 2025","passed","Sat Feb 01 22:17:04 GMT 2025","","getArgumentsListBySubcommand","",""
"","1","should convert empty array to csv string correctly","csvStringifier","Sat Feb 01 22:17:04 GMT 2025","passed","Sat Feb 01 22:17:04 GMT 2025","","","",""
"","180","the zip passes signature verification","PluginZip","Sat Feb 01 22:17:07 GMT 2025","passed","Sat Feb 01 22:17:07 GMT 2025","","","",""
"","3","should throw error when API response is error","deleteRecords","Sat Feb 01 22:17:04 GMT 2025","passed","Sat Feb 01 22:17:04 GMT 2025","","","",""
"","8453","Update by number field","","Sat Feb 01 22:19:34 GMT 2025","passed","Sat Feb 01 22:19:43 GMT 2025","","Update by number field","",""
"","2","should upsert records correctly with single line text","upsertRecords","Sat Feb 01 22:17:02 GMT 2025","passed","Sat Feb 01 22:17:02 GMT 2025","","","",""
"","1","should throw error when the record number is duplicated","validateRecordNumbers","Sat Feb 01 22:17:04 GMT 2025","passed","Sat Feb 01 22:17:04 GMT 2025","","","",""
"","13","should pass parameters to the apiClient correctly (without orderBy)","getAllRecords","Sat Feb 01 22:17:03 GMT 2025","passed","Sat Feb 01 22:17:03 GMT 2025","","","",""
"","1","userSelected should create schema correctly with updateKey","createSchema","Sat Feb 01 22:17:08 GMT 2025","passed","Sat Feb 01 22:17:08 GMT 2025","","","",""
"","7","should upsert records correctly with record number","upsertRecords","Sat Feb 01 22:17:02 GMT 2025","passed","Sat Feb 01 22:17:02 GMT 2025","","","",""
"","1","should throw error because the record number is invalid","upsertRecords","Sat Feb 01 22:17:02 GMT 2025","passed","Sat Feb 01 22:17:02 GMT 2025","","","",""
"","1","upper case is out of range","hex2a","Sat Feb 01 22:17:08 GMT 2025","passed","Sat Feb 01 22:17:08 GMT 2025","","","",""
"","935","Specified field does not exist","","Sat Feb 01 22:19:22 GMT 2025","passed","Sat Feb 01 22:19:23 GMT 2025","","Specified field does not exist","",""
"","128","Specified CSV does not exist","","Sat Feb 01 22:19:15 GMT 2025","passed","Sat Feb 01 22:19:15 GMT 2025","","Specified CSV does not exist","",""
"","2","should return the correct record number from CSV without subtable","parseCsv","Sat Feb 01 22:17:08 GMT 2025","passed","Sat Feb 01 22:17:08 GMT 2025","","","",""
"","1","should set ""none"" to the log config level when log-level argument is ""none""","logHandler","Sat Feb 01 22:17:08 GMT 2025","passed","Sat Feb 01 22:17:08 GMT 2025","","","",""
"","132","App is not specified","","Sat Feb 01 22:18:02 GMT 2025","passed","Sat Feb 01 22:18:02 GMT 2025","","App is not specified","",""
"","26","invalid `relative-path`","validate","Sat Feb 01 22:17:08 GMT 2025","passed","Sat Feb 01 22:17:08 GMT 2025","","","",""
"","2","should throw error when unsupported field is passed as update key","upsertRecords","Sat Feb 01 22:17:02 GMT 2025","passed","Sat Feb 01 22:17:02 GMT 2025","","","",""
"","8458","Upsert by record number","","Sat Feb 01 22:19:15 GMT 2025","passed","Sat Feb 01 22:19:23 GMT 2025","","Upsert by record number","",""
"","6","should throw error when update key field is not unique","upsertRecords","Sat Feb 01 22:17:02 GMT 2025","passed","Sat Feb 01 22:17:02 GMT 2025","","","",""
"","1","[17] convert CHECK_BOX field correctly","convertFieldValue","Sat Feb 01 22:17:02 GMT 2025","passed","Sat Feb 01 22:17:02 GMT 2025","","","",""
"","4","should pass username and password to the apiClient correctly","api","Sat Feb 01 22:17:01 GMT 2025","passed","Sat Feb 01 22:17:01 GMT 2025","","","",""
"","1","should set ""debug"" to the log config level when log-level argument is ""debug""","logHandler","Sat Feb 01 22:17:08 GMT 2025","passed","Sat Feb 01 22:17:08 GMT 2025","","","",""
"","3346","Invalid ordering with a non-existent field","","Sat Feb 01 22:19:12 GMT 2025","passed","Sat Feb 01 22:19:15 GMT 2025","","Invalid ordering with a non-existent field","",""
"","1","[21] convert DATETIME field correctly","convertFieldValue","Sat Feb 01 22:17:02 GMT 2025","passed","Sat Feb 01 22:17:02 GMT 2025","","","",""
"","3372","Encoding to utf8","","Sat Feb 01 22:19:31 GMT 2025","passed","Sat Feb 01 22:19:34 GMT 2025","","Encoding to utf8","",""
"","3442","Login authorization - short username option","","Sat Feb 01 22:18:22 GMT 2025","passed","Sat Feb 01 22:18:25 GMT 2025","","Login authorization - short username option","",""
"","0","[4] convert SINGLE_LINE_TEXT field correctly","convertFieldValue","Sat Feb 01 22:17:02 GMT 2025","passed","Sat Feb 01 22:17:02 GMT 2025","","","",""
"","5","can download files to a specified directory","getRecords","Sat Feb 01 22:17:01 GMT 2025","passed","Sat Feb 01 22:17:01 GMT 2025","","","",""
"","0","[30] convert SUBTABLE field correctly","convertFieldValue","Sat Feb 01 22:17:02 GMT 2025","passed","Sat Feb 01 22:17:02 GMT 2025","","","",""
"","2989","Specify a table","","Sat Feb 01 22:19:24 GMT 2025","passed","Sat Feb 01 22:19:27 GMT 2025","","Specify a table","",""
"","1","[21] convert USER_SELECT field correctly","convertFieldValue","Sat Feb 01 22:17:02 GMT 2025","passed","Sat Feb 01 22:17:02 GMT 2025","","","",""
"","0","[3] convert UPDATED_TIME field correctly","convertFieldValue","Sat Feb 01 22:17:02 GMT 2025","passed","Sat Feb 01 22:17:02 GMT 2025","","","",""
