"DESCRIPTION","DURATION IN MS","NAME","PARENT SUITE","START TIME","STATUS","STOP TIME","SUB SUITE","SUITE","TEST CLASS","TEST METHOD"
"","900","Incorrect API token","","Sun Mar 22 17:06:07 UTC 2026","passed","Sun Mar 22 17:06:07 UTC 2026","","Incorrect API token","",""
"","7","can detect file format correctly","readFile","Sun Mar 22 17:03:33 UTC 2026","passed","Sun Mar 22 17:03:33 UTC 2026","","","",""
"","1","should set ""debug"" to the log config level when verbose argument is true","logHandler","Sun Mar 22 17:03:33 UTC 2026","passed","Sun Mar 22 17:03:33 UTC 2026","","","",""
"","1","should throw error when missing required argument","Record command","Sun Mar 22 17:03:29 UTC 2026","passed","Sun Mar 22 17:03:29 UTC 2026","","Missing required parameters","",""
"","1","should stringify records as csv correctly (iterative)","stringifier","Sun Mar 22 17:03:33 UTC 2026","passed","Sun Mar 22 17:03:33 UTC 2026","","","",""
"","1","should not be set es parameters in supportEs is false","qa","Sun Mar 22 17:03:26 UTC 2026","passed","Sun Mar 22 17:03:26 UTC 2026","optional lang parameters","runPrompt","",""
"","5751","Delete all records","","Sun Mar 22 17:06:18 UTC 2026","passed","Sun Mar 22 17:06:23 UTC 2026","","Delete all records","",""
"","1","'should create schema correctly'","createSchema","Sun Mar 22 17:03:33 UTC 2026","passed","Sun Mar 22 17:03:33 UTC 2026","","","",""
"","1","[$#] convert 'MULTI_SELECT' field correctly","convertFieldValue","Sun Mar 22 17:03:26 UTC 2026","passed","Sun Mar 22 17:03:26 UTC 2026","","","",""
"","1","should set ""debug"" to the log config level when log-level argument is ""debug""","logHandler","Sun Mar 22 17:03:33 UTC 2026","passed","Sun Mar 22 17:03:33 UTC 2026","","","",""
"","219","Specify utf8 with sjis encoded file","","Sun Mar 22 17:06:09 UTC 2026","passed","Sun Mar 22 17:06:10 UTC 2026","","Specify utf8 with sjis encoded file","",""
"","1","should throw an Error if specified field is not supported","userSelected","Sun Mar 22 17:03:30 UTC 2026","passed","Sun Mar 22 17:03:30 UTC 2026","","","",""
"","1","[$#] convert 'FILE' field correctly","convertFieldValue","Sun Mar 22 17:03:26 UTC 2026","passed","Sun Mar 22 17:03:26 UTC 2026","","","",""
"","1570","Unsupported encoding","","Sun Mar 22 17:07:15 UTC 2026","passed","Sun Mar 22 17:07:16 UTC 2026","","Unsupported encoding","",""
"","392","Private key is not specified","","Sun Mar 22 17:06:05 UTC 2026","passed","Sun Mar 22 17:06:06 UTC 2026","","Private key is not specified","",""
"","1","should throw error when missing subcommand","Record command","Sun Mar 22 17:03:29 UTC 2026","passed","Sun Mar 22 17:03:29 UTC 2026","","Missing required parameters","",""
"","1","存在するTypeScriptテンプレート名から正しいTemplateSourceを生成する","template/github","Sun Mar 22 17:03:26 UTC 2026","passed","Sun Mar 22 17:03:26 UTC 2026","","resolveGitHubTemplateSource","",""
"","2","should not fail","deleteRecords","Sun Mar 22 17:03:30 UTC 2026","passed","Sun Mar 22 17:03:30 UTC 2026","","","",""
"","1","should be constructed with string cause","ParserError","Sun Mar 22 17:03:33 UTC 2026","passed","Sun Mar 22 17:03:33 UTC 2026","","","",""
"","1","should display the correct log message corresponding to the log config level","StandardLogger","Sun Mar 22 17:03:27 UTC 2026","passed","Sun Mar 22 17:03:27 UTC 2026","","","",""
"","4647","Login authorization - short password option","","Sun Mar 22 17:06:46 UTC 2026","passed","Sun Mar 22 17:06:51 UTC 2026","","Login authorization - short password option","",""
"","5051","Apply customization from manifest file","","Sun Mar 22 17:06:04 UTC 2026","failed","Sun Mar 22 17:06:09 UTC 2026","","Apply customization from manifest file","",""
"","2","存在しないファイルパスでエラーをスローする","template/manifest","Sun Mar 22 17:03:26 UTC 2026","passed","Sun Mar 22 17:03:26 UTC 2026","","updateManifests","",""
"","1169","URL does not exist","","Sun Mar 22 17:06:06 UTC 2026","passed","Sun Mar 22 17:06:07 UTC 2026","","URL does not exist","",""
"","1122","Incorrect guest space ID","","Sun Mar 22 17:06:08 UTC 2026","passed","Sun Mar 22 17:06:09 UTC 2026","","Incorrect guest space ID","",""
"","1","GitHub APIエラー時にエラーをスローする","template/github","Sun Mar 22 17:03:26 UTC 2026","passed","Sun Mar 22 17:03:26 UTC 2026","","resolveGitHubTemplateSource","",""
"","3","should reject when no auth is provided","buildConnectionOptions with either auth","Sun Mar 22 17:03:29 UTC 2026","passed","Sun Mar 22 17:03:29 UTC 2026","","","",""
"","4","should succeed the applying","index","Sun Mar 22 17:03:26 UTC 2026","passed","Sun Mar 22 17:03:26 UTC 2026","","apply","",""
"","4","不正なJSONファイルでエラーをスローする","template/package-json","Sun Mar 22 17:03:27 UTC 2026","passed","Sun Mar 22 17:03:27 UTC 2026","","updatePackageJson","",""
"","1","should not be set ja parameters in supportJa is false","qa","Sun Mar 22 17:03:26 UTC 2026","passed","Sun Mar 22 17:03:26 UTC 2026","optional lang parameters","runPrompt","",""
"","4106","Utf8 encoded file","","Sun Mar 22 17:07:06 UTC 2026","passed","Sun Mar 22 17:07:10 UTC 2026","","Utf8 encoded file","",""
"","3448","Update-key field is not set to unique (text)","","Sun Mar 22 17:06:47 UTC 2026","passed","Sun Mar 22 17:06:50 UTC 2026","","Update-key field is not set to unique (text)","",""
"","6","JavaScriptテンプレートで完全なセットアップが完了する","template","Sun Mar 22 17:03:26 UTC 2026","passed","Sun Mar 22 17:03:26 UTC 2026","","setupTemplate","",""
"","1","should pass basic auth params to the apiClient correctly","api","Sun Mar 22 17:03:25 UTC 2026","passed","Sun Mar 22 17:03:25 UTC 2026","","","",""
"","1","[$#] convert 'MULTI_SELECT' field correctly","convertFieldValue","Sun Mar 22 17:03:26 UTC 2026","passed","Sun Mar 22 17:03:26 UTC 2026","","","",""
"","1","[$#] convert 'USER_SELECT' field correctly","convertFieldValue","Sun Mar 22 17:03:26 UTC 2026","passed","Sun Mar 22 17:03:26 UTC 2026","","","",""
"","1","should pass parameters to the apiClient correctly","deleteRecords","Sun Mar 22 17:03:30 UTC 2026","passed","Sun Mar 22 17:03:30 UTC 2026","","","",""
"","4746","App in a guest space (record import)","","Sun Mar 22 17:06:32 UTC 2026","passed","Sun Mar 22 17:06:36 UTC 2026","","App in a guest space (record import)","",""
"","2","'should not throw error'","validateRecordNumbers","Sun Mar 22 17:03:30 UTC 2026","passed","Sun Mar 22 17:03:30 UTC 2026","","","",""
"","2080","Specified field does not exist","","Sun Mar 22 17:07:04 UTC 2026","passed","Sun Mar 22 17:07:06 UTC 2026","","Specified field does not exist","",""
"","1","should be able to validate by validateForDescription","qa","Sun Mar 22 17:03:26 UTC 2026","passed","Sun Mar 22 17:03:26 UTC 2026","","validator","",""
"","4","should pass parameters to the apiClient correctly (without orderBy)","getAllRecords","Sun Mar 22 17:03:27 UTC 2026","passed","Sun Mar 22 17:03:27 UTC 2026","","","",""
"","2","既存のmanifest.jsonフィールドを保持する","template/manifest","Sun Mar 22 17:03:26 UTC 2026","passed","Sun Mar 22 17:03:26 UTC 2026","","updateManifests","",""
"","1","[$#] convert 'SUBTABLE' field correctly","convertFieldValue","Sun Mar 22 17:03:26 UTC 2026","passed","Sun Mar 22 17:03:26 UTC 2026","","","",""
"","3925","Cancel the operation at confirmation","","Sun Mar 22 17:06:13 UTC 2026","passed","Sun Mar 22 17:06:17 UTC 2026","","Cancel the operation at confirmation","",""
"","1","[$#] convert 'DATETIME' field correctly","convertFieldValue","Sun Mar 22 17:03:26 UTC 2026","passed","Sun Mar 22 17:03:26 UTC 2026","","","",""
"","183","Login authentication is not supported","","Sun Mar 22 17:06:08 UTC 2026","passed","Sun Mar 22 17:06:08 UTC 2026","","Login authentication is not supported","",""
"","9752","Record with an attachment file","","Sun Mar 22 17:06:24 UTC 2026","passed","Sun Mar 22 17:06:34 UTC 2026","","Record with an attachment file","",""
"","1","can read utf8 encoded csv file correctly","readFile","Sun Mar 22 17:03:33 UTC 2026","passed","Sun Mar 22 17:03:33 UTC 2026","","","",""
"","1","'all fields have valid value'","fieldInSubtableReader","Sun Mar 22 17:03:30 UTC 2026","passed","Sun Mar 22 17:03:30 UTC 2026","","","",""
"","1356","Specified field does not exist","","Sun Mar 22 17:06:17 UTC 2026","passed","Sun Mar 22 17:06:19 UTC 2026","","Specified field does not exist","",""
"","856","Record number is not specified in a file","","Sun Mar 22 17:06:11 UTC 2026","passed","Sun Mar 22 17:06:12 UTC 2026","","Record number is not specified in a file","",""
"","1","should throw error when API response is error","getRecords","Sun Mar 22 17:03:25 UTC 2026","passed","Sun Mar 22 17:03:25 UTC 2026","","","",""
"","543","Get help","","Sun Mar 22 17:06:06 UTC 2026","passed","Sun Mar 22 17:06:06 UTC 2026","","Get help","",""
"","1","should throw error when API response is error","deleteAllRecords","Sun Mar 22 17:03:30 UTC 2026","passed","Sun Mar 22 17:03:30 UTC 2026","","","",""
"","4709","Valid condition query","","Sun Mar 22 17:06:43 UTC 2026","passed","Sun Mar 22 17:06:47 UTC 2026","","Valid condition query","",""
"","1","[$#] convert 'FILE' field correctly","convertFieldValue","Sun Mar 22 17:03:26 UTC 2026","passed","Sun Mar 22 17:03:26 UTC 2026","","","",""
"","4766","Specify a field","","Sun Mar 22 17:06:54 UTC 2026","passed","Sun Mar 22 17:06:59 UTC 2026","","Specify a field","",""
"","1","存在しないテンプレート名でfalseを返す","template/github","Sun Mar 22 17:03:26 UTC 2026","passed","Sun Mar 22 17:03:26 UTC 2026","","isGitHubTemplateExists","",""
"","3","多言語フィールド(ja, zh, es, etc)を正しく設定する","template/manifest","Sun Mar 22 17:03:26 UTC 2026","passed","Sun Mar 22 17:03:26 UTC 2026","","updateManifests","",""
"","2007","User does not have privilege to view records","","Sun Mar 22 17:06:12 UTC 2026","passed","Sun Mar 22 17:06:14 UTC 2026","","User does not have privilege to view records","",""
"","20","'`relative-path`'","validate","Sun Mar 22 17:03:30 UTC 2026","passed","Sun Mar 22 17:03:30 UTC 2026","","","",""
"","1","[$#] convert 'LINK' field correctly","convertFieldValue","Sun Mar 22 17:03:26 UTC 2026","passed","Sun Mar 22 17:03:26 UTC 2026","","","",""
"","456","Unknown option","","Sun Mar 22 17:06:05 UTC 2026","passed","Sun Mar 22 17:06:06 UTC 2026","","Unknown option","",""
"","4762","API token does not have privilege to edit records","","Sun Mar 22 17:07:08 UTC 2026","passed","Sun Mar 22 17:07:13 UTC 2026","","API token does not have privilege to edit records","",""
"","1","should not be set zh parameters in supportZh is false","qa","Sun Mar 22 17:03:26 UTC 2026","passed","Sun Mar 22 17:03:26 UTC 2026","optional lang parameters","runPrompt","",""
"","1","should return error message","AddRecordsError","Sun Mar 22 17:03:30 UTC 2026","passed","Sun Mar 22 17:03:30 UTC 2026","","","",""
"","3","should reject when only password is provided","buildConnectionOptions with password auth","Sun Mar 22 17:03:29 UTC 2026","passed","Sun Mar 22 17:03:29 UTC 2026","","","",""
"","6537","App has a table","","Sun Mar 22 17:06:22 UTC 2026","passed","Sun Mar 22 17:06:29 UTC 2026","","App has a table","",""
"","4164","Skip confirmation by --yes","","Sun Mar 22 17:06:09 UTC 2026","passed","Sun Mar 22 17:06:13 UTC 2026","","Skip confirmation by --yes","",""
"","1","should emit deprecation warning message","stability","Sun Mar 22 17:03:30 UTC 2026","passed","Sun Mar 22 17:03:30 UTC 2026","","emitDeprecationWarning","",""
"","4428","App in a guest space","","Sun Mar 22 17:06:04 UTC 2026","passed","Sun Mar 22 17:06:08 UTC 2026","","App in a guest space","",""
"","1","[$#] convert 'USER_SELECT' field correctly","convertFieldValue","Sun Mar 22 17:03:26 UTC 2026","passed","Sun Mar 22 17:03:26 UTC 2026","","","",""
"","1","should set ""info"" to the log config level when log-level argument is ""info""","logHandler","Sun Mar 22 17:03:33 UTC 2026","passed","Sun Mar 22 17:03:33 UTC 2026","","","",""
"","3","存在するテンプレート名でtrueを返す","template/github","Sun Mar 22 17:03:26 UTC 2026","passed","Sun Mar 22 17:03:26 UTC 2026","","isGitHubTemplateExists","",""
"","439","App is not specified","","Sun Mar 22 17:06:06 UTC 2026","passed","Sun Mar 22 17:06:07 UTC 2026","","App is not specified","",""
"","261","Cancel the operation at confirmation","","Sun Mar 22 17:06:16 UTC 2026","passed","Sun Mar 22 17:06:17 UTC 2026","","Cancel the operation at confirmation","",""
"","1","toStringCause should output the correct sentence. (inner: KintoneAllRecordsError)","CliKintoneError","Sun Mar 22 17:03:26 UTC 2026","passed","Sun Mar 22 17:03:26 UTC 2026","","","",""
"","1","toStringCause should output the correct sentence. (inner: CliKintoneError)","CliKintoneError","Sun Mar 22 17:03:26 UTC 2026","passed","Sun Mar 22 17:03:26 UTC 2026","","","",""
"","33","'`url`'","validate","Sun Mar 22 17:03:30 UTC 2026","passed","Sun Mar 22 17:03:30 UTC 2026","","","",""
"","4641","Encoding to sjis","","Sun Mar 22 17:07:21 UTC 2026","passed","Sun Mar 22 17:07:26 UTC 2026","","Encoding to sjis","",""
"","11793","Specify with app code and record number","","Sun Mar 22 17:06:08 UTC 2026","passed","Sun Mar 22 17:06:20 UTC 2026","","Specify with app code and record number","",""
"","2","'should throw error when the field spe…'","upsertRecords","Sun Mar 22 17:03:26 UTC 2026","passed","Sun Mar 22 17:03:26 UTC 2026","","","",""
"","3","should accept when only api-token is provided","buildConnectionOptions with either auth","Sun Mar 22 17:03:29 UTC 2026","passed","Sun Mar 22 17:03:29 UTC 2026","","","",""
"","193","File path is not specified","","Sun Mar 22 17:06:25 UTC 2026","passed","Sun Mar 22 17:06:25 UTC 2026","","File path is not specified","",""
"","817","A duplicate API token for the same app","","Sun Mar 22 17:06:07 UTC 2026","passed","Sun Mar 22 17:06:08 UTC 2026","","A duplicate API token for the same app","",""
"","3","should reject when no auth is provided","buildConnectionOptions with password auth","Sun Mar 22 17:03:29 UTC 2026","passed","Sun Mar 22 17:03:29 UTC 2026","","","",""
"","1","[$#] convert 'ORGANIZATION_SELECT' field correctly","convertFieldValue","Sun Mar 22 17:03:26 UTC 2026","passed","Sun Mar 22 17:03:26 UTC 2026","","","",""
"","2","should success generating customize-manifest.json","init","Sun Mar 22 17:03:33 UTC 2026","passed","Sun Mar 22 17:03:33 UTC 2026","","runInit","",""
"","1","存在するJavaScriptテンプレート名から正しいTemplateSourceを生成する","template/github","Sun Mar 22 17:03:26 UTC 2026","passed","Sun Mar 22 17:03:26 UTC 2026","","resolveGitHubTemplateSource","",""
"","853","Incorrect username","","Sun Mar 22 17:06:07 UTC 2026","passed","Sun Mar 22 17:06:08 UTC 2026","","Incorrect username","",""
"","193","Unsupported encoding","","Sun Mar 22 17:06:11 UTC 2026","passed","Sun Mar 22 17:06:11 UTC 2026","","Unsupported encoding","",""
"","4","should call kintone APIs by the right order","index","Sun Mar 22 17:03:26 UTC 2026","passed","Sun Mar 22 17:03:26 UTC 2026","","apply","",""
"","1","[$#] convert 'SINGLE_LINE_TEXT' field correctly","convertFieldValue","Sun Mar 22 17:03:26 UTC 2026","passed","Sun Mar 22 17:03:26 UTC 2026","","","",""
"","1","[$#] convert 'TIME' field correctly","convertFieldValue","Sun Mar 22 17:03:26 UTC 2026","passed","Sun Mar 22 17:03:26 UTC 2026","","","",""
"","1439","API token does not have privilege to add records","","Sun Mar 22 17:06:23 UTC 2026","passed","Sun Mar 22 17:06:24 UTC 2026","","API token does not have privilege to add records","",""
"","1","should emit experimental warning message","stability","Sun Mar 22 17:03:30 UTC 2026","passed","Sun Mar 22 17:03:30 UTC 2026","","emitExperimentalWarning","",""
"","8","should generate file correctly with baseDir","File Generator functions","Sun Mar 22 17:03:31 UTC 2026","passed","Sun Mar 22 17:03:31 UTC 2026","","Generate file success","",""
"","197","File path is not specified","","Sun Mar 22 17:06:08 UTC 2026","passed","Sun Mar 22 17:06:08 UTC 2026","","File path is not specified","",""
"","2178","Incorrect guest space","","Sun Mar 22 17:06:36 UTC 2026","passed","Sun Mar 22 17:06:39 UTC 2026","","Incorrect guest space","",""
"","1","should return result when given function is resolved","retry","Sun Mar 22 17:03:26 UTC 2026","passed","Sun Mar 22 17:03:26 UTC 2026","","input sync function","",""
"","572","No app option","","Sun Mar 22 17:06:06 UTC 2026","passed","Sun Mar 22 17:06:07 UTC 2026","","No app option","",""
"","1","should pass guestSpaceId to the apiClient correctly","api","Sun Mar 22 17:03:25 UTC 2026","passed","Sun Mar 22 17:03:25 UTC 2026","","","",""
"","1","should return error message","DeleteRecordsError","Sun Mar 22 17:03:33 UTC 2026","passed","Sun Mar 22 17:03:33 UTC 2026","","","",""
"","1","[$#] convert 'RICH_TEXT' field correctly","convertFieldValue","Sun Mar 22 17:03:26 UTC 2026","passed","Sun Mar 22 17:03:26 UTC 2026","","","",""
"","5","should upload files correctly when attachmentsDir is given","addRecords","Sun Mar 22 17:03:25 UTC 2026","passed","Sun Mar 22 17:03:25 UTC 2026","","","",""
"","4","TypeScriptテンプレートで完全なセットアップが完了する","template","Sun Mar 22 17:03:26 UTC 2026","passed","Sun Mar 22 17:03:26 UTC 2026","","setupTemplate","",""
"","3","should reject when only username is provided without password","buildConnectionOptions with either auth","Sun Mar 22 17:03:29 UTC 2026","passed","Sun Mar 22 17:03:29 UTC 2026","","","",""
"","3284","App does not have records","","Sun Mar 22 17:06:29 UTC 2026","passed","Sun Mar 22 17:06:32 UTC 2026","","App does not have records","",""
"","2","the exported privateKey is the same as original privateKey","PrivateKey","Sun Mar 22 17:03:33 UTC 2026","passed","Sun Mar 22 17:03:33 UTC 2026","","","",""
"","22","'`valid-locales-v1`'","validate","Sun Mar 22 17:03:30 UTC 2026","passed","Sun Mar 22 17:03:30 UTC 2026","","","",""
"","254","Password is not specified","","Sun Mar 22 17:06:07 UTC 2026","passed","Sun Mar 22 17:06:07 UTC 2026","","Password is not specified","",""
"","1","'should throw error when update key fi…'","upsertRecords","Sun Mar 22 17:03:26 UTC 2026","passed","Sun Mar 22 17:03:26 UTC 2026","","","",""
"","1","should generate fieldCode array correctly (data with subtable)","buildHeaderFields","Sun Mar 22 17:03:30 UTC 2026","passed","Sun Mar 22 17:03:30 UTC 2026","","","",""
"","1","[$#] convert 'MULTI_LINE_TEXT' field correctly","convertFieldValue","Sun Mar 22 17:03:26 UTC 2026","passed","Sun Mar 22 17:03:26 UTC 2026","","","",""
"","4844","Login authorization","","Sun Mar 22 17:06:28 UTC 2026","passed","Sun Mar 22 17:06:33 UTC 2026","","Login authorization","",""
"","10","should success updating customize-manifest.json and downloading uploaded js/css files","export","Sun Mar 22 17:03:26 UTC 2026","passed","Sun Mar 22 17:03:26 UTC 2026","","runExport","",""
"","1","should pass parameters to the apiClient correctly","deleteAllRecords","Sun Mar 22 17:03:30 UTC 2026","passed","Sun Mar 22 17:03:30 UTC 2026","","","",""
"","917","App in guest space is specified without guest space ID","","Sun Mar 22 17:06:06 UTC 2026","passed","Sun Mar 22 17:06:07 UTC 2026","","App in guest space is specified without guest space ID","",""
"","1","should display DEBUG message when calling logger with ""debug"" level","StandardLogger","Sun Mar 22 17:03:27 UTC 2026","passed","Sun Mar 22 17:03:27 UTC 2026","","","",""
"","1","should return distinct local files from the manifest","sourceListV2","Sun Mar 22 17:03:30 UTC 2026","passed","Sun Mar 22 17:03:30 UTC 2026","","","",""
"","4734","App in a space","","Sun Mar 22 17:06:20 UTC 2026","passed","Sun Mar 22 17:06:25 UTC 2026","","App in a space","",""
"","40","manifest v1","ContentsZip","Sun Mar 22 17:03:29 UTC 2026","passed","Sun Mar 22 17:03:29 UTC 2026","","should be able to create ContentsZip from a plugin directory","",""
"","741","Valid and invalid API tokens","","Sun Mar 22 17:06:23 UTC 2026","passed","Sun Mar 22 17:06:24 UTC 2026","","Valid and invalid API tokens","",""
"","2","should throw error when attachmentsDir is NOT given","addRecords","Sun Mar 22 17:03:25 UTC 2026","passed","Sun Mar 22 17:03:25 UTC 2026","","","",""
"","4","'should convert subtable included csv …'","parseCsv","Sun Mar 22 17:03:32 UTC 2026","passed","Sun Mar 22 17:03:32 UTC 2026","","","",""
"","1","'should convert csv string with no rec…'","parseCsv","Sun Mar 22 17:03:32 UTC 2026","passed","Sun Mar 22 17:03:32 UTC 2026","","","",""
"","1","should be set es parameters in supportEs is true","qa","Sun Mar 22 17:03:26 UTC 2026","passed","Sun Mar 22 17:03:26 UTC 2026","optional lang parameters","runPrompt","",""
"","8746","Multiple records have attachments","","Sun Mar 22 17:06:33 UTC 2026","passed","Sun Mar 22 17:06:41 UTC 2026","","Multiple records have attachments","",""
"","1","'should convert empty csv string to JS…'","parseCsv","Sun Mar 22 17:03:32 UTC 2026","passed","Sun Mar 22 17:03:32 UTC 2026","","","",""
"","1","can separate data source by chunk","chunked","Sun Mar 22 17:03:26 UTC 2026","passed","Sun Mar 22 17:03:26 UTC 2026","","","",""
"","1","should return a file list including the manifest","sourcelist","Sun Mar 22 17:03:30 UTC 2026","passed","Sun Mar 22 17:03:30 UTC 2026","","","",""
"","5029","Invalid API token and valid login information","","Sun Mar 22 17:06:24 UTC 2026","passed","Sun Mar 22 17:06:29 UTC 2026","","Invalid API token and valid login information","",""
"","1","should be able to validate by validateForName","qa","Sun Mar 22 17:03:26 UTC 2026","passed","Sun Mar 22 17:03:26 UTC 2026","","validator","",""
"","1","should be set ja parameters in supportJa is true","qa","Sun Mar 22 17:03:26 UTC 2026","passed","Sun Mar 22 17:03:26 UTC 2026","optional lang parameters","runPrompt","",""
"","4242","App in a guest space (record export)","","Sun Mar 22 17:06:19 UTC 2026","passed","Sun Mar 22 17:06:23 UTC 2026","","App in a guest space (record export)","",""
"","318","should reject --api-token with auth required error","plugin upload","Sun Mar 22 17:03:28 UTC 2026","passed","Sun Mar 22 17:03:29 UTC 2026","","","",""
"","1","[$#] convert 'CATEGORY' field correctly","convertFieldValue","Sun Mar 22 17:03:26 UTC 2026","passed","Sun Mar 22 17:03:26 UTC 2026","","","",""
"","1","'should throw error when the record nu…'","validateRecordNumbers","Sun Mar 22 17:03:30 UTC 2026","passed","Sun Mar 22 17:03:30 UTC 2026","","","",""
"","3380","Upload plugin.zip","","Sun Mar 22 17:06:05 UTC 2026","passed","Sun Mar 22 17:06:09 UTC 2026","","Upload plugin.zip","",""
"","1","[$#] convert 'MODIFIER' field correctly","convertFieldValue","Sun Mar 22 17:03:26 UTC 2026","passed","Sun Mar 22 17:03:26 UTC 2026","","","",""
"","1","should throw an Error if specified field is in a Table field","userSelected","Sun Mar 22 17:03:30 UTC 2026","passed","Sun Mar 22 17:03:30 UTC 2026","","","",""
"","10584","Upsert by text field","","Sun Mar 22 17:06:36 UTC 2026","passed","Sun Mar 22 17:06:47 UTC 2026","","Upsert by text field","",""
"","4","should detect the mismatch encoding correctly","isMismatchEncoding","Sun Mar 22 17:03:33 UTC 2026","passed","Sun Mar 22 17:03:33 UTC 2026","","","",""
"","909","Generates a private key file","","Sun Mar 22 17:06:05 UTC 2026","passed","Sun Mar 22 17:06:06 UTC 2026","","Generates a private key file","",""
"","8","should generate file correctly","File Generator functions","Sun Mar 22 17:03:31 UTC 2026","passed","Sun Mar 22 17:03:31 UTC 2026","","Generate file success","",""
"","827","Specify sjis with utf8 encoded file","","Sun Mar 22 17:06:10 UTC 2026","passed","Sun Mar 22 17:06:11 UTC 2026","","Specify sjis with utf8 encoded file","",""
"","1","[$#] convert 'NUMBER' field correctly","convertFieldValue","Sun Mar 22 17:03:26 UTC 2026","passed","Sun Mar 22 17:03:26 UTC 2026","","","",""
"","3304","Specify attachments directory nevertheless app does not have an attachment field","","Sun Mar 22 17:06:51 UTC 2026","passed","Sun Mar 22 17:06:54 UTC 2026","","Specify attachments directory nevertheless app does not have an attachment field","",""
"","1","GITHUB_TOKEN環境変数が設定されている場合、認証ヘッダーを使用する","template/github","Sun Mar 22 17:03:26 UTC 2026","passed","Sun Mar 22 17:03:26 UTC 2026","","isGitHubTemplateExists","",""
"","1","[$#] convert 'UPDATED_TIME' field correctly","convertFieldValue","Sun Mar 22 17:03:26 UTC 2026","passed","Sun Mar 22 17:03:26 UTC 2026","","","",""
"","1","should return true if the string is URL","util","Sun Mar 22 17:03:33 UTC 2026","passed","Sun Mar 22 17:03:33 UTC 2026","","isUrlString","",""
"","11383","Sjis encoded file","","Sun Mar 22 17:06:20 UTC 2026","passed","Sun Mar 22 17:06:32 UTC 2026","","Sjis encoded file","",""
"","1","[$#] convert 'DATE' field correctly","convertFieldValue","Sun Mar 22 17:03:26 UTC 2026","passed","Sun Mar 22 17:03:26 UTC 2026","","","",""
"","1","[$#] convert 'SINGLE_LINE_TEXT' field correctly","convertFieldValue","Sun Mar 22 17:03:26 UTC 2026","passed","Sun Mar 22 17:03:26 UTC 2026","","","",""
"","1","should pass information of client certificate and proxy server to the apiClient correctly","api","Sun Mar 22 17:03:25 UTC 2026","passed","Sun Mar 22 17:03:25 UTC 2026","","","",""
"","4723","API tokens for different apps","","Sun Mar 22 17:06:29 UTC 2026","passed","Sun Mar 22 17:06:34 UTC 2026","","API tokens for different apps","",""
"","2","フォーマットされたJSON(インデント2)で書き込む","template/package-json","Sun Mar 22 17:03:27 UTC 2026","passed","Sun Mar 22 17:03:27 UTC 2026","","updatePackageJson","",""
"","10302","Specify records with a file","","Sun Mar 22 17:06:29 UTC 2026","passed","Sun Mar 22 17:06:40 UTC 2026","","Specify records with a file","",""
