"DESCRIPTION","DURATION IN MS","NAME","PARENT SUITE","START TIME","STATUS","STOP TIME","SUB SUITE","SUITE","TEST CLASS","TEST METHOD"
"","126","App is not specified","","Wed May 21 22:12:28 GMT 2025","passed","Wed May 21 22:12:28 GMT 2025","","App is not specified","",""
"","654","Specified attachment directory does not exist","","Wed May 21 22:13:15 GMT 2025","passed","Wed May 21 22:13:16 GMT 2025","","Specified attachment directory does not exist","",""
"","2","should replace a special character","utils/operateFilename.ts","Wed May 21 22:11:34 GMT 2025","passed","Wed May 21 22:11:34 GMT 2025","","","",""
"","326","should throw error when an undefined argument is passed","main","Wed May 21 22:11:31 GMT 2025","passed","Wed May 21 22:11:31 GMT 2025","","","",""
"","0","[2] convert RADIO_BUTTON field correctly","convertFieldValue","Wed May 21 22:11:27 GMT 2025","passed","Wed May 21 22:11:27 GMT 2025","","","",""
"","1","should throw error when the field specified in schema does not exist on input record","upsertRecords","Wed May 21 22:11:27 GMT 2025","passed","Wed May 21 22:11:27 GMT 2025","","","",""
"","1","can separate date source by group and chunked","groupByKeyChunked","Wed May 21 22:11:27 GMT 2025","passed","Wed May 21 22:11:27 GMT 2025","","","",""
"","2885","App does not have records","","Wed May 21 22:14:31 GMT 2025","passed","Wed May 21 22:14:34 GMT 2025","","App does not have records","",""
"","1","[25] convert ORGANIZATION_SELECT field correctly","convertFieldValue","Wed May 21 22:11:28 GMT 2025","passed","Wed May 21 22:11:28 GMT 2025","","","",""
"","641","Unsupported file type","","Wed May 21 22:13:57 GMT 2025","passed","Wed May 21 22:13:57 GMT 2025","","Unsupported file type","",""
"","1177","Record data with required field empty","","Wed May 21 22:15:28 GMT 2025","passed","Wed May 21 22:15:29 GMT 2025","","Record data with required field empty","",""
"","2","should be constructed with string cause","ParserError","Wed May 21 22:11:34 GMT 2025","passed","Wed May 21 22:11:34 GMT 2025","","","",""
"","4253","Login authorization - short password option","","Wed May 21 22:12:58 GMT 2025","passed","Wed May 21 22:13:03 GMT 2025","","Login authorization - short password option","",""
"","3","should repeat given function after delay on error and return result on resolve","retry","Wed May 21 22:11:27 GMT 2025","passed","Wed May 21 22:11:27 GMT 2025","","input sync function","",""
"","2","should throw an error when all retries are failed","retry","Wed May 21 22:11:27 GMT 2025","passed","Wed May 21 22:11:27 GMT 2025","","input async function","",""
"","2","should display TRACE message when calling logger with ""trace"" level","StandardLogger","Wed May 21 22:11:28 GMT 2025","passed","Wed May 21 22:11:28 GMT 2025","","","",""
"","1","[5] convert NUMBER field correctly","convertFieldValue","Wed May 21 22:11:28 GMT 2025","passed","Wed May 21 22:11:28 GMT 2025","","","",""
"","630","Incorrect guest space ID","","Wed May 21 22:14:16 GMT 2025","passed","Wed May 21 22:14:17 GMT 2025","","Incorrect guest space ID","",""
"","1","should set ""warn"" to the log config level when log-level argument is ""warn""","logHandler","Wed May 21 22:11:33 GMT 2025","passed","Wed May 21 22:11:33 GMT 2025","","","",""
"","606","A duplicate API token for the same app","","Wed May 21 22:12:46 GMT 2025","passed","Wed May 21 22:12:46 GMT 2025","","A duplicate API token for the same app","",""
"","1","should pass (input: 1, appCode: App, result: false)","hasAppCode","Wed May 21 22:11:33 GMT 2025","passed","Wed May 21 22:11:33 GMT 2025","","","",""
"","1","should set ""none"" to the log config level when log-level argument is ""none""","logHandler","Wed May 21 22:11:33 GMT 2025","passed","Wed May 21 22:11:33 GMT 2025","","","",""
"","6799","Record has a .txt file attachment","","Wed May 21 22:13:31 GMT 2025","passed","Wed May 21 22:13:38 GMT 2025","","Record has a .txt file attachment","",""
"","4","formLayout should create schema correctly","createSchema","Wed May 21 22:11:33 GMT 2025","passed","Wed May 21 22:11:33 GMT 2025","","","",""
"","4","should upload files correctly when attachmentsDir is given and with subtable","addRecords","Wed May 21 22:11:27 GMT 2025","passed","Wed May 21 22:11:27 GMT 2025","","","",""
"","1","should generate fieldCode array correctly (data with subtable)","buildHeaderFields","Wed May 21 22:11:29 GMT 2025","passed","Wed May 21 22:11:29 GMT 2025","","","",""
"","4","should throw error when update key field is not unique","upsertRecords","Wed May 21 22:11:27 GMT 2025","passed","Wed May 21 22:11:27 GMT 2025","","","",""
"","0","[13] convert TIME field correctly","convertFieldValue","Wed May 21 22:11:27 GMT 2025","passed","Wed May 21 22:11:27 GMT 2025","","","",""
"","9","should throw with invalid error (input: App-123, appCode: )","hasAppCode","Wed May 21 22:11:33 GMT 2025","passed","Wed May 21 22:11:33 GMT 2025","","","",""
"","3","should show warning message if there is no records exist in the app or match the condition.","getRecords","Wed May 21 22:11:26 GMT 2025","passed","Wed May 21 22:11:26 GMT 2025","","","",""
"","0","[22] convert USER_SELECT field correctly","convertFieldValue","Wed May 21 22:11:27 GMT 2025","passed","Wed May 21 22:11:27 GMT 2025","","","",""
"","2","can get records","getRecords","Wed May 21 22:11:26 GMT 2025","passed","Wed May 21 22:11:26 GMT 2025","","","",""
"","2","should return result when given function is resolved","retry","Wed May 21 22:11:27 GMT 2025","passed","Wed May 21 22:11:27 GMT 2025","","input sync function","",""
"","25","`fileExists`","validate","Wed May 21 22:11:30 GMT 2025","passed","Wed May 21 22:11:30 GMT 2025","","","",""
"","1","[16] convert DATE field correctly","convertFieldValue","Wed May 21 22:11:28 GMT 2025","passed","Wed May 21 22:11:28 GMT 2025","","","",""
"","0","[21] convert DATETIME field correctly","convertFieldValue","Wed May 21 22:11:28 GMT 2025","passed","Wed May 21 22:11:28 GMT 2025","","","",""
"","1","[12] convert MULTI_SELECT field correctly","convertFieldValue","Wed May 21 22:11:28 GMT 2025","passed","Wed May 21 22:11:28 GMT 2025","","","",""
"","6038","Press Enter for confirmation message","","Wed May 21 22:14:23 GMT 2025","passed","Wed May 21 22:14:29 GMT 2025","","Press Enter for confirmation message","",""
"","23","`invalid-locales-v1`","validate","Wed May 21 22:11:30 GMT 2025","passed","Wed May 21 22:11:30 GMT 2025","","","",""
"","2","can separate data source by chunk","chunked","Wed May 21 22:11:27 GMT 2025","passed","Wed May 21 22:11:27 GMT 2025","","","",""
"","130","Specify utf8 with sjis encoded file","","Wed May 21 22:14:05 GMT 2025","passed","Wed May 21 22:14:05 GMT 2025","","Specify utf8 with sjis encoded file","",""
"","649","App does not exist","","Wed May 21 22:12:28 GMT 2025","passed","Wed May 21 22:12:29 GMT 2025","","App does not exist","",""
"","0","[15] convert MODIFIER field correctly","convertFieldValue","Wed May 21 22:11:27 GMT 2025","passed","Wed May 21 22:11:27 GMT 2025","","","",""
"","3","should throw error when the record number is invalid","validateRecordNumbers","Wed May 21 22:11:29 GMT 2025","passed","Wed May 21 22:11:29 GMT 2025","","","",""
"","1","should repeat given function after delay on error and return result on resolve","retry","Wed May 21 22:11:27 GMT 2025","passed","Wed May 21 22:11:28 GMT 2025","","input async function","",""
"","699","Record number is not specified in a file","","Wed May 21 22:14:29 GMT 2025","passed","Wed May 21 22:14:30 GMT 2025","","Record number is not specified in a file","",""
"","120","Get version","","Wed May 21 22:12:26 GMT 2025","passed","Wed May 21 22:12:26 GMT 2025","","Get version","",""
"","124","No app option","","Wed May 21 22:12:28 GMT 2025","passed","Wed May 21 22:12:28 GMT 2025","","No app option","",""
"","1","[5] convert RICH_TEXT field correctly","convertFieldValue","Wed May 21 22:11:27 GMT 2025","passed","Wed May 21 22:11:27 GMT 2025","","","",""
"","1","should be constructed with CsvError","ParserError","Wed May 21 22:11:34 GMT 2025","passed","Wed May 21 22:11:34 GMT 2025","","","",""
"","0","should not display any message when calling logger with 'none' level","StandardLogger","Wed May 21 22:11:28 GMT 2025","passed","Wed May 21 22:11:28 GMT 2025","","","",""
"","34","`relative-path`","validate","Wed May 21 22:11:30 GMT 2025","passed","Wed May 21 22:11:30 GMT 2025","","","",""
"","2","should throw error when API response is error","deleteAllRecords","Wed May 21 22:11:29 GMT 2025","passed","Wed May 21 22:11:29 GMT 2025","","","",""
"","1","toStringCause should output the correct sentence. (inner: KintoneAllRecordsError)","CliKintoneError","Wed May 21 22:11:28 GMT 2025","passed","Wed May 21 22:11:28 GMT 2025","","","",""
"","1","userSelected should create schema correctly","createSchema","Wed May 21 22:11:34 GMT 2025","passed","Wed May 21 22:11:34 GMT 2025","","","",""
"","1","[20] convert DATETIME field correctly","convertFieldValue","Wed May 21 22:11:28 GMT 2025","passed","Wed May 21 22:11:28 GMT 2025","","","",""
"","3896","API token does not have delete permission","","Wed May 21 22:12:26 GMT 2025","passed","Wed May 21 22:12:30 GMT 2025","","API token does not have delete permission","",""
"","1","should stringify records as csv correctly (iterative)","stringifier","Wed May 21 22:11:33 GMT 2025","passed","Wed May 21 22:11:33 GMT 2025","","","",""
"","0","should throw with invalid error (input: Hoge-123, appCode: App)","hasAppCode","Wed May 21 22:11:33 GMT 2025","passed","Wed May 21 22:11:33 GMT 2025","","","",""
"","9631","Specify with app code and record number","","Wed May 21 22:13:14 GMT 2025","passed","Wed May 21 22:13:24 GMT 2025","","Specify with app code and record number","",""
