"Status","Start Time","Stop Time","Duration in ms","Parent Suite","Suite","Sub Suite","Test Class","Test Method","Name","Description"
"passed","Fri Oct 25 08:27:36 GMT 2024","Fri Oct 25 08:27:36 GMT 2024","1","upsertRecords","","","","","should throw error when the field in table specified in schema does not exist on input record",""
"passed","Fri Oct 25 08:37:34 GMT 2024","Fri Oct 25 08:37:35 GMT 2024","702","","CliKintoneTest-14 Should return the error message when no authorized information","","","","CliKintoneTest-14 Should return the error message when no authorized information",""
"passed","Fri Oct 25 08:38:18 GMT 2024","Fri Oct 25 08:38:19 GMT 2024","771","","CliKintoneTest-34 Should return the error message when importing non-existent attachment.","","","","CliKintoneTest-34 Should return the error message when importing non-existent attachment.",""
"passed","Fri Oct 25 08:37:56 GMT 2024","Fri Oct 25 08:37:59 GMT 2024","3463","","CliKintoneTest-29 Should return the error message when updating records with an API Token without View/Edit permission.","","","","CliKintoneTest-29 Should return the error message when updating records with an API Token without View/Edit permission.",""
"passed","Fri Oct 25 08:37:36 GMT 2024","Fri Oct 25 08:37:37 GMT 2024","710","","CliKintoneTest-18 Should return the error message when authorization information is incomplete (password)","","","","CliKintoneTest-18 Should return the error message when authorization information is incomplete (password)",""
"passed","Fri Oct 25 08:27:37 GMT 2024","Fri Oct 25 08:27:37 GMT 2024","23","packer","with privateKey","","","","the zip passes signature verification",""
"passed","Fri Oct 25 08:37:31 GMT 2024","Fri Oct 25 08:37:36 GMT 2024","4503","","CliKintoneTest-126 Should return the error message with an API Token without Delete permission.","","","","CliKintoneTest-126 Should return the error message with an API Token without Delete permission.",""
"passed","Fri Oct 25 08:27:38 GMT 2024","Fri Oct 25 08:27:38 GMT 2024","0","convertFieldValue","","","","","[22] convert USER_SELECT field correctly",""
"passed","Fri Oct 25 08:27:42 GMT 2024","Fri Oct 25 08:27:42 GMT 2024","4","ParserError","","","","","should throw error when the record number field code is not found",""
"passed","Fri Oct 25 08:27:38 GMT 2024","Fri Oct 25 08:27:38 GMT 2024","1","CliKintoneError","","","","","toStringCause should output the correct sentence. (inner: KintoneRestAPIError with GAIA_IL23)",""
"passed","Fri Oct 25 08:27:34 GMT 2024","Fri Oct 25 08:27:34 GMT 2024","1","api","","","","","should pass guestSpaceId to the apiClient correctly",""
"passed","Fri Oct 25 08:39:31 GMT 2024","Fri Oct 25 08:39:38 GMT 2024","6317","","CliKintoneTest-167 Should not delete the records when specifying ""N"" in the confirmation prompt.","","","","CliKintoneTest-167 Should not delete the records when specifying ""N"" in the confirmation prompt.",""
