"DESCRIPTION","DURATION IN MS","NAME","PARENT SUITE","START TIME","STATUS","STOP TIME","SUB SUITE","SUITE","TEST CLASS","TEST METHOD"
"","1","should throw an Error if specified field is not supported","userSelected","Thu Nov 06 06:34:51 UTC 2025","passed","Thu Nov 06 06:34:51 UTC 2025","","","",""
"","2","should return error message","AddRecordsError","Thu Nov 06 06:34:52 UTC 2025","passed","Thu Nov 06 06:34:52 UTC 2025","","","",""
"","2","should throw error when the record number is invalid","validateRecordNumbers","Thu Nov 06 06:34:52 UTC 2025","passed","Thu Nov 06 06:34:52 UTC 2025","","","",""
"","3","should show warning message if there is no records exist in the app or match the condition.","getRecords","Thu Nov 06 06:34:49 UTC 2025","passed","Thu Nov 06 06:34:49 UTC 2025","","","",""
"","4401","Login authorization - short username option","","Thu Nov 06 06:39:49 UTC 2025","passed","Thu Nov 06 06:39:54 UTC 2025","","Login authorization - short username option","",""
"","5026","Delete all records","","Thu Nov 06 06:39:37 UTC 2025","passed","Thu Nov 06 06:39:42 UTC 2025","","Delete all records","",""
"","2054","Specified field does not exist","","Thu Nov 06 06:41:51 UTC 2025","passed","Thu Nov 06 06:41:53 UTC 2025","","Specified field does not exist","",""
"","706","Valid and invalid API tokens","","Thu Nov 06 06:39:42 UTC 2025","passed","Thu Nov 06 06:39:43 UTC 2025","","Valid and invalid API tokens","",""
"","1","[4] convert SINGLE_LINE_TEXT field correctly","convertFieldValue","Thu Nov 06 06:34:50 UTC 2025","passed","Thu Nov 06 06:34:50 UTC 2025","","","",""
"","2","should throw error when API response is error","deleteRecords","Thu Nov 06 06:34:51 UTC 2025","passed","Thu Nov 06 06:34:51 UTC 2025","","","",""
"","164","Unsupported encoding","","Thu Nov 06 06:41:07 UTC 2025","passed","Thu Nov 06 06:41:08 UTC 2025","","Unsupported encoding","",""
"","1971","Specify a field in a table","","Thu Nov 06 06:41:53 UTC 2025","passed","Thu Nov 06 06:41:55 UTC 2025","","Specify a field in a table","",""
"","173","Unknown subcommand","","Thu Nov 06 06:39:22 UTC 2025","passed","Thu Nov 06 06:39:22 UTC 2025","","Unknown subcommand","",""
"","1","should be constructed with CsvError","ParserError","Thu Nov 06 06:34:55 UTC 2025","passed","Thu Nov 06 06:34:55 UTC 2025","","","",""
"","1","should stringify records as csv correctly (iterative)","stringifier","Thu Nov 06 06:34:55 UTC 2025","passed","Thu Nov 06 06:34:55 UTC 2025","","","",""
"","10352","Sjis encoded file","","Thu Nov 06 06:40:56 UTC 2025","passed","Thu Nov 06 06:41:06 UTC 2025","","Sjis encoded file","",""
"","154","Login authentication is not supported","","Thu Nov 06 06:39:49 UTC 2025","passed","Thu Nov 06 06:39:49 UTC 2025","","Login authentication is not supported","",""
"","8426","Multiple records have attachments","","Thu Nov 06 06:40:13 UTC 2025","passed","Thu Nov 06 06:40:21 UTC 2025","","Multiple records have attachments","",""
"","2","should upsert records correctly with number","upsertRecords","Thu Nov 06 06:34:50 UTC 2025","passed","Thu Nov 06 06:34:50 UTC 2025","","","",""
"","8942","Record with .txt file attachment","","Thu Nov 06 06:40:49 UTC 2025","passed","Thu Nov 06 06:40:58 UTC 2025","","Record with .txt file attachment","",""
"","324","Private key is not specified","","Thu Nov 06 06:39:22 UTC 2025","passed","Thu Nov 06 06:39:23 UTC 2025","","Private key is not specified","",""
"","9695","Upsert by text field","","Thu Nov 06 06:41:09 UTC 2025","passed","Thu Nov 06 06:41:19 UTC 2025","","Upsert by text field","",""
"","1","should display WARN message when calling logger with ""warn"" level","StandardLogger","Thu Nov 06 06:34:51 UTC 2025","passed","Thu Nov 06 06:34:51 UTC 2025","","","",""
"","1","should pass parameters to the apiClient correctly","deleteAllRecords","Thu Nov 06 06:34:52 UTC 2025","passed","Thu Nov 06 06:34:52 UTC 2025","","","",""
"","0","[27] convert CATEGORY field correctly","convertFieldValue","Thu Nov 06 06:34:50 UTC 2025","passed","Thu Nov 06 06:34:50 UTC 2025","","","",""
"","720","Unsupported file type","","Thu Nov 06 06:39:59 UTC 2025","passed","Thu Nov 06 06:40:00 UTC 2025","","Unsupported file type","",""
"","1","can iterate from data source with next value","withNextIterator","Thu Nov 06 06:34:50 UTC 2025","passed","Thu Nov 06 06:34:50 UTC 2025","","","",""
"","1695","API token for different app","","Thu Nov 06 06:39:38 UTC 2025","passed","Thu Nov 06 06:39:39 UTC 2025","","API token for different app","",""
"","5","should throw an Error if specified field is in a Table field","userSelected","Thu Nov 06 06:34:51 UTC 2025","passed","Thu Nov 06 06:34:51 UTC 2025","","","",""
"","2","all fields have valid value","fieldInSubtableReader","Thu Nov 06 06:34:51 UTC 2025","passed","Thu Nov 06 06:34:51 UTC 2025","","","",""
"","1","should return the arguments list of the record export correctly","Record - Subcommand","Thu Nov 06 06:34:52 UTC 2025","passed","Thu Nov 06 06:34:52 UTC 2025","","getArgumentsListBySubcommand","",""
"","3480","Upload plugin.zip","","Thu Nov 06 06:39:22 UTC 2025","passed","Thu Nov 06 06:39:25 UTC 2025","","Upload plugin.zip","",""
"","157","Unsupported encoding","","Thu Nov 06 06:41:27 UTC 2025","passed","Thu Nov 06 06:41:28 UTC 2025","","Unsupported encoding","",""
"","4","should throw an Error if specified field is in a Table field","userSelected","Thu Nov 06 06:34:51 UTC 2025","passed","Thu Nov 06 06:34:51 UTC 2025","","","",""
"","0","userSelected should create schema correctly with updateKey","createSchema","Thu Nov 06 06:34:55 UTC 2025","passed","Thu Nov 06 06:34:55 UTC 2025","","","",""
"","1","should throw an error when retry conditions are not match","retry","Thu Nov 06 06:34:50 UTC 2025","passed","Thu Nov 06 06:34:50 UTC 2025","","input async function","",""
"","660","Incorrect API token","","Thu Nov 06 06:39:26 UTC 2025","passed","Thu Nov 06 06:39:27 UTC 2025","","Incorrect API token","",""
"","11","should pass parameters to the apiClient correctly (without orderBy)","getAllRecords","Thu Nov 06 06:34:51 UTC 2025","passed","Thu Nov 06 06:34:51 UTC 2025","","","",""
"","6","manifest v2","ContentsZip","Thu Nov 06 06:34:51 UTC 2025","passed","Thu Nov 06 06:34:51 UTC 2025","","should be able to create ContentsZip from a plugin directory","",""
"","2","should return error message","DeleteAllRecordsError","Thu Nov 06 06:34:51 UTC 2025","passed","Thu Nov 06 06:34:51 UTC 2025","","","",""
"","682","Pack a plugin","","Thu Nov 06 06:39:22 UTC 2025","passed","Thu Nov 06 06:39:22 UTC 2025","","Pack a plugin","",""
"","1","should replace placeholders correctly","Helper functions","Thu Nov 06 06:34:51 UTC 2025","passed","Thu Nov 06 06:34:51 UTC 2025","","replacePlaceholders","",""
"","1","[1] convert SINGLE_LINE_TEXT field correctly","convertFieldValue","Thu Nov 06 06:34:50 UTC 2025","passed","Thu Nov 06 06:34:50 UTC 2025","","","",""
"","1","should upsert records correctly with single line text","upsertRecords","Thu Nov 06 06:34:50 UTC 2025","passed","Thu Nov 06 06:34:50 UTC 2025","","","",""
"","0","[5] convert RICH_TEXT field correctly","convertFieldValue","Thu Nov 06 06:34:50 UTC 2025","passed","Thu Nov 06 06:34:50 UTC 2025","","","",""
"","","can download files including special characters","getRecords","Thu Nov 06 06:34:46 UTC 2025","skipped","","","","",""
"","1","should pass information of client certificate and proxy server to the apiClient correctly","api","Thu Nov 06 06:34:49 UTC 2025","passed","Thu Nov 06 06:34:49 UTC 2025","","","",""
"","0","[20] convert DATETIME field correctly","convertFieldValue","Thu Nov 06 06:34:50 UTC 2025","passed","Thu Nov 06 06:34:50 UTC 2025","","","",""
"","1","[23] convert USER_SELECT field correctly","convertFieldValue","Thu Nov 06 06:34:50 UTC 2025","passed","Thu Nov 06 06:34:50 UTC 2025","","","",""
"","4220","Exported data is in CSV format","","Thu Nov 06 06:39:33 UTC 2025","passed","Thu Nov 06 06:39:37 UTC 2025","","Exported data is in CSV format","",""
"","1","[16] convert MULTI_SELECT field correctly","convertFieldValue","Thu Nov 06 06:34:50 UTC 2025","passed","Thu Nov 06 06:34:50 UTC 2025","","","",""
"","2","should return result when given function is resolved","retry","Thu Nov 06 06:34:50 UTC 2025","passed","Thu Nov 06 06:34:50 UTC 2025","","input sync function","",""
"","10163","Utf8 encoded file","","Thu Nov 06 06:40:46 UTC 2025","passed","Thu Nov 06 06:40:56 UTC 2025","","Utf8 encoded file","",""
"","1","should pass guestSpaceId to the apiClient correctly","api","Thu Nov 06 06:34:49 UTC 2025","passed","Thu Nov 06 06:34:49 UTC 2025","","","",""
"","0","[22] convert USER_SELECT field correctly","convertFieldValue","Thu Nov 06 06:34:50 UTC 2025","passed","Thu Nov 06 06:34:50 UTC 2025","","","",""
"","2","should convert kintone records to csv string correctly when SUBTABLE included with attachmentsDir option","csvStringifier","Thu Nov 06 06:34:52 UTC 2025","passed","Thu Nov 06 06:34:52 UTC 2025","","","",""
"","1","should throw error when missing required argument","Record command","Thu Nov 06 06:34:51 UTC 2025","passed","Thu Nov 06 06:34:51 UTC 2025","","Missing required parameters","",""
"","0","[13] convert TIME field correctly","convertFieldValue","Thu Nov 06 06:34:50 UTC 2025","passed","Thu Nov 06 06:34:50 UTC 2025","","","",""
"","3032","API token does not have privilege to view and edit records","","Thu Nov 06 06:39:44 UTC 2025","passed","Thu Nov 06 06:39:47 UTC 2025","","API token does not have privilege to view and edit records","",""
"","1","should throw an Error if specified field does not exist","userSelected","Thu Nov 06 06:34:51 UTC 2025","passed","Thu Nov 06 06:34:51 UTC 2025","","","",""
"","1","[9] convert CHECK_BOX field correctly","convertFieldValue","Thu Nov 06 06:34:50 UTC 2025","passed","Thu Nov 06 06:34:50 UTC 2025","","","",""
"","712","Incorrect password","","Thu Nov 06 06:39:28 UTC 2025","passed","Thu Nov 06 06:39:29 UTC 2025","","Incorrect password","",""
"","2","should return the correct record number from CSV without subtable","parseCsv","Thu Nov 06 06:34:55 UTC 2025","passed","Thu Nov 06 06:34:55 UTC 2025","","","",""
"","395","Get help","","Thu Nov 06 06:39:22 UTC 2025","passed","Thu Nov 06 06:39:22 UTC 2025","","Get help","",""
