"DESCRIPTION","DURATION IN MS","NAME","PARENT SUITE","START TIME","STATUS","STOP TIME","SUB SUITE","SUITE","TEST CLASS","TEST METHOD"
"","506","API token is a draft","","Thu Jan 09 05:55:08 GMT 2025","passed","Thu Jan 09 05:55:09 GMT 2025","","API token is a draft","",""
"","126","File path is not specified","","Thu Jan 09 05:56:12 GMT 2025","passed","Thu Jan 09 05:56:12 GMT 2025","","File path is not specified","",""
"","34","invalid `maxFileSize`","validate","Thu Jan 09 05:49:40 GMT 2025","passed","Thu Jan 09 05:49:40 GMT 2025","","","",""
"","1","should pass parameters to the apiClient correctly","deleteAllRecords","Thu Jan 09 05:49:36 GMT 2025","passed","Thu Jan 09 05:49:36 GMT 2025","","","",""
"","2","[0] convert RECORD_NUMBER field correctly","convertFieldValue","Thu Jan 09 05:49:34 GMT 2025","passed","Thu Jan 09 05:49:34 GMT 2025","","","",""
"","2","should be constructed with string cause","ParserError","Thu Jan 09 05:49:41 GMT 2025","passed","Thu Jan 09 05:49:41 GMT 2025","","","",""
"","1053","App does not have records","","Thu Jan 09 05:56:19 GMT 2025","passed","Thu Jan 09 05:56:20 GMT 2025","","App does not have records","",""
"","1","[8] convert CALC field correctly","convertFieldValue","Thu Jan 09 05:49:34 GMT 2025","passed","Thu Jan 09 05:49:34 GMT 2025","","","",""
"","0","[16] convert MULTI_SELECT field correctly","convertFieldValue","Thu Jan 09 05:49:34 GMT 2025","passed","Thu Jan 09 05:49:34 GMT 2025","","","",""
"","5","should throw error when missing subcommand","Record command","Thu Jan 09 05:49:35 GMT 2025","passed","Thu Jan 09 05:49:35 GMT 2025","","Missing required parameters","",""
"","2343","App does not have records","","Thu Jan 09 05:56:39 GMT 2025","passed","Thu Jan 09 05:56:42 GMT 2025","","App does not have records","",""
"","3283","Specify multiple fields","","Thu Jan 09 05:56:16 GMT 2025","passed","Thu Jan 09 05:56:20 GMT 2025","","Specify multiple fields","",""
"","1","should convert kintone records to csv string correctly when SUBTABLE included without attachmentsDir option","csvStringifier","Thu Jan 09 05:49:36 GMT 2025","passed","Thu Jan 09 05:49:36 GMT 2025","","","",""
"","937","Specify a field in a table","","Thu Jan 09 05:56:21 GMT 2025","passed","Thu Jan 09 05:56:21 GMT 2025","","Specify a field in a table","",""
"","126","URL protocol is not HTTPS","","Thu Jan 09 05:54:58 GMT 2025","passed","Thu Jan 09 05:54:59 GMT 2025","","URL protocol is not HTTPS","",""
"","1003","User does not have privilege to add records","","Thu Jan 09 05:55:00 GMT 2025","passed","Thu Jan 09 05:55:01 GMT 2025","","User does not have privilege to add records","",""
"","1541","Specified field does not exist","","Thu Jan 09 05:56:56 GMT 2025","passed","Thu Jan 09 05:56:58 GMT 2025","","Specified field does not exist","",""
"","8045","Specify with app code and record number","","Thu Jan 09 05:55:37 GMT 2025","passed","Thu Jan 09 05:55:45 GMT 2025","","Specify with app code and record number","",""
"","1","should return the arguments list of the record delete correctly","Record - Subcommand","Thu Jan 09 05:49:36 GMT 2025","passed","Thu Jan 09 05:49:36 GMT 2025","","getArgumentsListBySubcommand","",""
"","130","App is not specified","","Thu Jan 09 05:54:59 GMT 2025","passed","Thu Jan 09 05:54:59 GMT 2025","","App is not specified","",""
"","1","[20] convert DATETIME field correctly","convertFieldValue","Thu Jan 09 05:49:34 GMT 2025","passed","Thu Jan 09 05:49:34 GMT 2025","","","",""
"","4563","App has a table","","Thu Jan 09 05:56:35 GMT 2025","passed","Thu Jan 09 05:56:39 GMT 2025","","App has a table","",""
"","1","should convert csv string with no record to JSON correctly","parseCsv","Thu Jan 09 05:49:38 GMT 2025","passed","Thu Jan 09 05:49:38 GMT 2025","","","",""
"","1","[9] convert CHECK_BOX field correctly","convertFieldValue","Thu Jan 09 05:49:34 GMT 2025","passed","Thu Jan 09 05:49:34 GMT 2025","","","",""
"","1","should throw error when the field in table specified in schema does not exist on input record","upsertRecords","Thu Jan 09 05:49:34 GMT 2025","passed","Thu Jan 09 05:49:34 GMT 2025","","","",""
"","0","[25] convert ORGANIZATION_SELECT field correctly","convertFieldValue","Thu Jan 09 05:49:34 GMT 2025","passed","Thu Jan 09 05:49:34 GMT 2025","","","",""
"","0","should set ""none"" to the log config level when log-level argument is ""none""","logHandler","Thu Jan 09 05:49:40 GMT 2025","passed","Thu Jan 09 05:49:40 GMT 2025","","","",""
"","5660","Record has a .txt file attachment","","Thu Jan 09 05:55:50 GMT 2025","passed","Thu Jan 09 05:55:55 GMT 2025","","Record has a .txt file attachment","",""
"","119","Base URL is not specified","","Thu Jan 09 05:54:58 GMT 2025","passed","Thu Jan 09 05:54:58 GMT 2025","","Base URL is not specified","",""
"","4","should not fail","deleteAllRecords","Thu Jan 09 05:49:36 GMT 2025","passed","Thu Jan 09 05:49:36 GMT 2025","","","",""
"","1","upper case is out of range","hex2a","Thu Jan 09 05:49:41 GMT 2025","passed","Thu Jan 09 05:49:41 GMT 2025","","","",""
"","3","should throw error when the record number is invalid","validateRecordNumbers","Thu Jan 09 05:49:36 GMT 2025","passed","Thu Jan 09 05:49:36 GMT 2025","","","",""
"","128","Specified CSV does not exist","","Thu Jan 09 05:56:12 GMT 2025","passed","Thu Jan 09 05:56:13 GMT 2025","","Specified CSV does not exist","",""
"","2","should pass (input: 1, appCode: , result: false)","hasAppCode","Thu Jan 09 05:49:40 GMT 2025","passed","Thu Jan 09 05:49:40 GMT 2025","","","",""
"","8991","Remove attachments by upserting","","Thu Jan 09 05:57:14 GMT 2025","passed","Thu Jan 09 05:57:23 GMT 2025","","Remove attachments by upserting","",""
"","3","should convert multiple subtables included csv string to JSON correctly","parseCsv","Thu Jan 09 05:49:38 GMT 2025","passed","Thu Jan 09 05:49:38 GMT 2025","","","",""
"","2","should replace a special character","utils/operateFilename.ts","Thu Jan 09 05:49:41 GMT 2025","passed","Thu Jan 09 05:49:41 GMT 2025","","","",""
"","2","empty string","hex2a","Thu Jan 09 05:49:41 GMT 2025","passed","Thu Jan 09 05:49:41 GMT 2025","","","",""
"","0","should return the export query correctly","Record command","Thu Jan 09 05:49:35 GMT 2025","passed","Thu Jan 09 05:49:35 GMT 2025","","Valid parameters","",""
"","1","userSelected should create schema correctly","createSchema","Thu Jan 09 05:49:40 GMT 2025","passed","Thu Jan 09 05:49:41 GMT 2025","","","",""
"","3467","Login authorization","","Thu Jan 09 05:55:16 GMT 2025","passed","Thu Jan 09 05:55:19 GMT 2025","","Login authorization","",""
"","13","should pass parameters to the apiClient correctly (without orderBy)","getAllRecords","Thu Jan 09 05:49:35 GMT 2025","passed","Thu Jan 09 05:49:35 GMT 2025","","","",""
"","7371","Specify records with a file","","Thu Jan 09 05:55:18 GMT 2025","passed","Thu Jan 09 05:55:26 GMT 2025","","Specify records with a file","",""
"","605","App in guest space is specified without guest space ID","","Thu Jan 09 05:54:59 GMT 2025","passed","Thu Jan 09 05:55:00 GMT 2025","","App in guest space is specified without guest space ID","",""
"","553","Incorrect guest space ID","","Thu Jan 09 05:56:02 GMT 2025","passed","Thu Jan 09 05:56:03 GMT 2025","","Incorrect guest space ID","",""
"","1","should set ""debug"" to the log config level when log-level argument is ""debug""","logHandler","Thu Jan 09 05:49:40 GMT 2025","passed","Thu Jan 09 05:49:40 GMT 2025","","","",""
"","1","can separate date source by group","groupByKey","Thu Jan 09 05:49:34 GMT 2025","passed","Thu Jan 09 05:49:34 GMT 2025","","","",""
"","120","File path is not specified","","Thu Jan 09 05:55:26 GMT 2025","passed","Thu Jan 09 05:55:26 GMT 2025","","File path is not specified","",""
"","1","number","hex2a","Thu Jan 09 05:49:41 GMT 2025","passed","Thu Jan 09 05:49:41 GMT 2025","","","",""
